Symbol,Name,Market Cap,Country,IPO Year,Volume,Sector,Industry
JCI,Johnson Controls International plc Ordinary Share,44918890335.0,Switzerland,None,3938340,Industrials,Industrial Machinery/Components
JCSE,JE Cleantech Holdings Limited Ordinary Shares,8373650.0,Singapore,2022.0,22943,Consumer Discretionary,Miscellaneous manufacturing industries
JCTCF,Jewett-Cameron Trading Company Common Shares,17039638.0,United States,None,582,Consumer Discretionary,RETAIL: Building Materials
JD,JD.com Inc. American Depositary Shares,62624612211.0,China,2014.0,11053115,Consumer Discretionary,Other Specialty Stores
JEF,Jefferies Financial Group Inc. Common Stock,7694302506.0,United States,None,1824540,Finance,Investment Bankers/Brokers/Service
JELD,JELD-WEN Holding Inc. Common Stock,1335756712.0,United States,2017.0,947220,Basic Materials,Forest Products
JEQ,abrdn Japan Equity Fund Inc. Common Stock,83639939.0,United States,1992.0,8984,Consumer Discretionary,Air Freight/Delivery Services
JEWL,Adamas One Corp. Common Stock,28658292.0,United States,2022.0,75648,Consumer Discretionary,Consumer Specialties
JFBR,Jeffs' Brands Ltd Ordinary Shares,7089495.0,Israel,2022.0,2173047,Consumer Discretionary,Other Specialty Stores
JFBRW,Jeffs' Brands Ltd Warrant,888164.0,Israel,2022.0,261,Consumer Discretionary,Other Specialty Stores
JFIN,Jiayin Group Inc. American Depositary Shares,305630188.0,China,2019.0,152102,Finance,Finance: Consumer Services
JFR,Nuveen Floating Rate Income Fund Common Stock,0.0,United States,2004.0,226292,Finance,Trusts Except Educational Religious and Charitable
JFU,9F Inc. American Depositary Shares,45648744.0,China,2019.0,5130,Finance,Finance: Consumer Services
JG,Aurora Mobile Limited American Depositary Shares,26900334.0,China,2018.0,767988,Technology,EDP Services
JGGC,Jaguar Global Growth Corporation I Class A Ordinary Shares,0.0,United States,2022.0,58754,Finance,Blank Checks
JGGCR,Jaguar Global Growth Corporation I Right,0.0,United States,2022.0,5648,Finance,Blank Checks
JGGCU,Jaguar Global Growth Corporation I Unit,0.0,United States,2022.0,100,Finance,Blank Checks
JGGCW,Jaguar Global Growth Corporation I Warrant,0.0,United States,2022.0,10000,Finance,Blank Checks
JGH,Nuveen Global High Income Fund Common Shares of Beneficial Interest,0.0,United States,2014.0,25003,Finance,Investment Managers
JHAA,Nuveen Corporate Income 2023 Target Term Fund,73096166.0,None,2018.0,21409,Finance,Finance/Investors Services
JHG,Janus Henderson Group plc Ordinary Shares,4648360814.0,None,2017.0,2086517,Finance,Investment Managers
JHI,John Hancock Investors Trust Common Stock,110356183.0,United States,None,10931,Finance,Trusts Except Educational Religious and Charitable
JHS,John Hancock Income Securities Trust Common Stock,124967857.0,United States,None,24187,Finance,Finance Companies
JHX,James Hardie Industries plc American Depositary Shares (Ireland),12160968703.0,Ireland,None,33427,Industrials,Building Materials
JILL,J. Jill Inc. Common Stock,215094231.0,None,2017.0,39986,Consumer Discretionary,Apparel
JJSF,J & J Snack Foods Corp. Common Stock,2997195106.0,United States,1986.0,190077,Consumer Staples,Specialty Foods
JKHY,Jack Henry & Associates Inc. Common Stock,11918027380.0,United States,1985.0,733181,Technology,Retail: Computer Software & Peripheral Equipment
JKS,JinkoSolar Holding Company Limited American Depositary Shares (each representing 4 Common Shares),2386795691.0,China,2010.0,1745594,Technology,Semiconductors
JLL,Jones Lang LaSalle Incorporated Common Stock,7213458822.0,United States,None,487517,Finance,Real Estate
JLS,Nuveen Mortgage and Income Fund,0.0,United States,2009.0,2668,Finance,Investment Managers
JMIA,Jumia Technologies AG American Depositary Shares each representing two Ordinary Shares,369261748.0,None,2019.0,2409103,Consumer Discretionary,Catalog/Specialty Distribution
JMM,Nuveen Multi-Market Income Fund (MA),0.0,United States,None,1078,Finance,Trusts Except Educational Religious and Charitable
JMSB,John Marshall Bancorp Inc. Common Stock,299881987.0,United States,None,32367,Finance,Major Banks
JNJ,Johnson & Johnson Common Stock,426790097137.0,United States,None,13425946,Health Care,Biotechnology: Pharmaceutical Preparations
JNPR,Juniper Networks Inc. Common Stock,10442095682.0,United States,1999.0,6113562,Telecommunications,Computer Communications Equipment
JOAN,JOANN Inc. Common Stock,41950026.0,United States,2021.0,369146,Consumer Discretionary,Other Specialty Stores
JOB,GEE Group Inc. Common Stock,60658741.0,United States,1968.0,172406,Consumer Discretionary,Diversified Commercial Services
JOBY,Joby Aviation Inc. Common Stock,4669242395.0,United States,2020.0,10761349,Consumer Discretionary,Aerospace
JOE,St. Joe Company (The) Common Stock,2655344100.0,United States,None,566735,Real Estate,Homebuilding
JOF,Japan Smaller Capitalization Fund Inc Common Stock,0.0,United States,1990.0,33539,Finance,Trusts Except Educational Religious and Charitable
JOUT,Johnson Outdoors Inc. Class A Common Stock,603313704.0,United States,None,44574,Consumer Discretionary,Recreational Games/Products/Toys
JPC,Nuveen Preferred & Income Opportunities Fund,0.0,United States,2003.0,384199,Finance,Investment Managers
JPI,Nuveen Preferred and Income Term Fund Common Shares of Beneficial Interest,383032088.0,None,2012.0,54041,Finance,Finance Companies
JPM,JP Morgan Chase & Co. Common Stock,418647051799.0,United States,None,13812666,Finance,Major Banks
JPM^C,J P Morgan Chase & Co Depositary Shares each representing a 1/400th interest in a share of 6.00% Non-Cumulative  Preferred Stock Series EE,None,United States,None,110632,None,None
JPM^D,J P Morgan Chase & Co Depositary Shares each representing a 1/400th  interest in a share of 5.75% Non-Cumulative  Preferred Stock Series DD,None,United States,None,70732,None,None
JPM^J,J P Morgan Chase & Co Depositary Shares each representing a 1/400th interest in a share of JPMorgan Chase & Co. 4.75% Non-Cumulative Preferred Stock Series GG,None,United States,None,23613,None,None
JPM^K,J P Morgan Chase & Co Depositary Shares each representing a 1/400th interest in a share of 4.55% Non-Cumulative Preferred Stock Series JJ,None,United States,None,51721,None,None
JPM^L,J P Morgan Chase & Co Depositary Shares each representing a 1/400th interest in a share of 4.625% Non-Cumulative Preferred Stock Series LL,None,United States,None,50842,None,None
JPM^M,J P Morgan Chase & Co Depositary Shares each representing a 1/400th interest in a share of 4.20% Non-Cumulative Preferred Stock Series MM,None,United States,None,101997,None,None
JPS,Nuveen Preferred & Income Securities Fund,0.0,United States,2002.0,356679,Finance,Investment Managers
JPT,Nuveen Preferred and Income Fund Common Shares of Beneficial Interest,71451722.0,United States,2017.0,22816,Finance,Trusts Except Educational Religious and Charitable
JQC,Nuveen Credit Strategies Income Fund Shares of Beneficial Interest,0.0,United States,2003.0,316121,Finance,Finance Companies
JRI,Nuveen Real Asset Income and Growth Fund Common Shares of Beneficial Interest,0.0,United States,2012.0,77519,Finance,Finance Companies
JRO,Nuveen Floating Rate Income Opportuntiy Fund Shares of Beneficial Interest,0.0,United States,2004.0,131315,Finance,Investment Managers
JRS,Nuveen Real Estate Income Fund Common Shares of Beneficial Interest,0.0,United States,2001.0,200572,Finance,Finance/Investors Services
JRSH,Jerash Holdings (US) Inc. Common Stock,50872450.0,United States,2018.0,14746,Consumer Discretionary,Apparel
JRVR,James River Group Holdings Ltd. Common Shares,753889289.0,Bermuda,2014.0,902253,Finance,Property-Casualty Insurers
JSD,Nuveen Short Duration Credit Opportunities Fund Common Shares of Beneficial Interest,0.0,United States,2011.0,32866,Finance,Finance Companies
JSM,Navient Corporation 6% Senior Notes due December 15 2043,2400302758.0,United States,None,5005,Finance,Finance: Consumer Services
JSPR,Jasper Therapeutics Inc. Common Stock,150948779.0,United States,2020.0,354263,Health Care,Biotechnology: Biological Products (No Diagnostic Substances)
JSPRW,Japer Therapeutics Inc. Warrants,15762115.0,United States,2020.0,3952,Health Care,Biotechnology: Pharmaceutical Preparations
JT,Jianpu Technology Inc. American depositary shares,25254655.0,None,2017.0,6025,Technology,EDP Services
JUGG,Jaws Juggernaut Acquisition Corporation Class A Ordinary Share,0.0,United States,2021.0,102,None,None
JUGGU,Jaws Juggernaut Acquisition Corporation Unit,0.0,United States,2021.0,1241,None,None
JUGGW,Jaws Juggernaut Acquisition Corporation Warrant,0.0,United States,2021.0,750,None,None
JUN,Juniper II Corp. Class A Common Stock,0.0,None,2021.0,92,Finance,Blank Checks
JUPW,Jupiter Wellness Inc. Common Stock,9009280.0,United States,2020.0,90106,Health Care,Biotechnology: Pharmaceutical Preparations
JUPWW,Jupiter Wellness Inc. Warrant,1332734.0,United States,2020.0,500,Health Care,Biotechnology: Pharmaceutical Preparations
JVA,Coffee Holding Co. Inc. Common Stock,9476274.0,United States,2005.0,14080,Consumer Staples,Packaged Foods
JWEL,Jowell Global Ltd. Ordinary Shares,6998012.0,China,2021.0,171629,Consumer Discretionary,Other Consumer Services
JWN,Nordstrom Inc. Common Stock,3078071676.0,United States,None,8008630,Consumer Discretionary,Clothing/Shoe/Accessory Stores
JWSM,Jaws Mustang Acquisition Corp. Class A Ordinary Shares,0.0,None,2021.0,621,Finance,Blank Checks
JXJT,JX Luxventure Limited Common Stock,18786000.0,China,2013.0,20620,Consumer Staples,Apparel
JXN,Jackson Financial Inc. Class A Common Stock ,2473068848.0,None,2021.0,1557159,Finance,Life Insurance
JXN^A,Jackson Financial Inc. Depositary Shares each representing a 1/1000th interest in a share of Fixed-Rate Reset Noncumulative Perpetual Preferred Stock Series A,None,None,None,96040,None,None
JYD,Jayud Global Logistics Limited Class A Ordinary Shares,47934492.0,China,2023.0,53421,Consumer Discretionary,Oil Refining/Marketing
JYNT,The Joint Corp. Common Stock,212402931.0,United States,2014.0,134333,Miscellaneous,Multi-Sector Companies
JZ,Jianzhi Education Technology Group Company Limited American Depositary Shares,61160550.0,China,2022.0,15865,Consumer Discretionary,Educational Services
JZXN,Jiuzi Holdings Inc. Ordinary Shares,5663916.0,China,2021.0,658014,Consumer Discretionary,Retail-Auto Dealers and Gas Stations
K,Kellogg Company Common Stock,22721455728.0,United States,None,3915528,Consumer Staples,Packaged Foods
KA,Kineta Inc. Common Stock,28015043.0,United States,2016.0,35774,Health Care,Biotechnology: Pharmaceutical Preparations
KACL,Kairous Acquisition Corp. Limited Ordinary Shares,0.0,Malaysia,2022.0,3310,Finance,Blank Checks
KACLR,Kairous Acquisition Corp. Limited Rights,0.0,Malaysia,2022.0,9080,Finance,Blank Checks
KACLW,Kairous Acquisition Corp. Limited Warrants,0.0,Malaysia,2022.0,1,Finance,Blank Checks
KAI,Kadant Inc Common Stock,2618653874.0,United States,1992.0,155280,Industrials,Industrial Machinery/Components
KALA,Kala Pharmaceuticals Inc. Common Stock,810065049.0,United States,2017.0,26162,Health Care,Biotechnology: Pharmaceutical Preparations
KALU,Kaiser Aluminum Corporation Common Stock,1137908648.0,United States,None,418210,Industrials,Metal Fabrications
KALV,KalVista Pharmaceuticals Inc. Common Stock,329735077.0,United Kingdom,2015.0,251892,Health Care,Biotechnology: Pharmaceutical Preparations
KAMN,Kaman Corporation Common Stock,629451527.0,United States,None,1020900,Industrials,Military/Government/Technical
KAR,OPENLANE Inc. Common Stock,1680724278.0,United States,2009.0,2005183,Consumer Discretionary,Retail-Auto Dealers and Gas Stations
KARO,Karooooo Ltd. Ordinary Shares,737874367.0,Singapore,2021.0,2315,Technology,Computer Software: Prepackaged Software
KAVL,Kaival Brands Innovations Group Inc. Common Stock,43250199.0,United States,None,36575,Health Care, Medicinal Chemicals and Botanical Products
KB,KB Financial Group Inc,14794415700.0,South Korea,None,196185,Finance,Commercial Banks
KBH,KB Home Common Stock,4188077818.0,United States,1986.0,2437300,Consumer Discretionary,Homebuilding
KBNT,Kubient Inc. Common Stock,7834253.0,United States,2020.0,48140,Technology,EDP Services
KBNTW,Kubient Inc. Warrant,3614469.0,United States,2020.0,1252,Technology,EDP Services
KBR,KBR Inc. Common Stock,8899300326.0,United States,2006.0,1863034,Industrials,Military/Government/Technical
KC,Kingsoft Cloud Holdings Limited American Depositary Shares,1595682757.0,China,2020.0,4693101,Technology,Computer Software: Prepackaged Software
KCGI,Kensington Capital Acquisition Corp. V Class A Ordinary Shares,0.0,None,2021.0,29673,Finance,Blank Checks
KD,Kyndryl Holdings Inc. Common Stock,3075890855.0,None,2021.0,2591493,Technology,EDP Services
KDNY,Chinook Therapeutics Inc. Common Stock,2544471597.0,United States,2015.0,4274902,Health Care,Biotechnology: Pharmaceutical Preparations
KDP,Keurig Dr Pepper Inc. Common Stock,45159487045.0,United States,None,15546280,Consumer Staples,Beverages (Production/Distribution)
KE,Kimball Electronics Inc. Common Stock,674231143.0,United States,None,105541,Technology,Electrical Products
KELYA,Kelly Services Inc. Class A Common Stock,625936650.0,United States,None,1608200,Consumer Discretionary,Professional Services
KELYB,Kelly Services Inc. Class B Common Stock,656908602.0,United States,None,14,Consumer Discretionary,Professional Services
KEN,Kenon Holdings Ltd. Ordinary Shares,1407606800.0,Singapore,2015.0,11944,Utilities,Electric Utilities: Central
KEP,Korea Electric Power Corporation Common Stock,9513907621.0,South Korea,1994.0,695882,Utilities,Electric Utilities: Central
KEQU,Kewaunee Scientific Corporation Common Stock,47858682.0,United States,None,199,Industrials,Medical Specialities
KERN,Akerna Corp. Common Stock,9685043.0,United States,2018.0,39323,Technology,EDP Services
KERNW,Akerna Corp Warrant,57101.0,United States,2018.0,42015,Technology,EDP Services
KEX,Kirby Corporation Common Stock,4473000000.0,United States,None,522813,Consumer Discretionary,Marine Transportation
KEY,KeyCorp Common Stock,9287175909.0,United States,None,28302335,Finance,Major Banks
KEY^I,KeyCorp Depositary Shares Each Representing a 1/40th Ownership Interest in a Share of Fixed-to-Floating Rate Perpetual Non-Cumulative Preferred Stock Series E,None,United States,None,48245,None,None
KEY^J,KeyCorp Depositary Shares each representing a 1/40th ownership interest in a share of Fixed Rate Perpetual Non-Cumulative Preferred Stock Series F,None,United States,None,39505,None,None
KEY^K,KeyCorp Depositary Shares each representing a 1/40th ownership interest in a share of Fixed Rate Perpetual Non-Cumulative Preferred Stock Series G,None,United States,None,72316,None,None
KEY^L,KeyCorp Depositary Shares each representing a 1/40th ownership interest in a share of Fixed Rate Perpetual Non-Cumulative Preferred Stock Series H,None,United States,None,30435,None,None
KEYS,Keysight Technologies Inc. Common Stock,29405708419.0,United States,2014.0,1927645,Industrials,Industrial Machinery/Components
KF,Korea Fund Inc. (The) New Common Stock,0.0,United States,None,1031,Finance,Investment Managers
KFFB,Kentucky First Federal Bancorp Common Stock,52068179.0,United States,2005.0,6229,Finance,Savings Institutions
KFRC,Kforce Inc. Common Stock,1246919545.0,United States,1995.0,267174,Consumer Discretionary,Professional Services
KFS,Kingsway Financial Services Inc. Common Stock (DE),230335192.0,Canada,None,172505,Finance,Property-Casualty Insurers
KFY,Korn Ferry Common Stock,2671816326.0,United States,1999.0,853982,Consumer Discretionary,Diversified Commercial Services
KGC,Kinross Gold Corporation Common Stock,5990507440.0,Canada,2001.0,31457277,None,None
KHC,The Kraft Heinz Company Common Stock,45395514533.0,United States,None,12250209,Consumer Staples,Packaged Foods
KIDS,OrthoPediatrics Corp. Common Stock,1080516043.0,United States,2017.0,157433,Health Care,Medical/Dental Instruments
KIM,Kimco Realty Corporation (HC) Common Stock,12056895685.0,United States,None,4548327,Real Estate,Real Estate Investment Trusts
KIM^L,Kimco Realty Corporation Class L Depositary Shares each of which represents a one-one thousandth fractional interest in a share of 5.125% Class L Cumulative Redeemable Preferred Stock liquidation preference $25000.00 per share,None,United States,None,9227,None,None
KIM^M,Kimco Realty Corporation Class M Depositary Shares each of which represents a one-one thousandth fractional interest in a share of 5.25% Class M Cumulative Redeemable Preferred Stock liquidation preference $25000.00 per share,None,United States,None,14189,None,None
KIND,Nextdoor Holdings Inc. Class A Common Stock,153024590.0,United States,None,1693866,Technology,Computer Software: Programming Data Processing
KINS,Kingstone Companies Inc. Common Stock,14096358.0,United States,None,37991,Finance,Specialty Insurers
KIO,KKR Income Opportunities Fund Common Shares,0.0,None,2013.0,101564,Finance,Investment Managers
KIQ,Kelso Technologies Inc Ordinary Shares,13493109.0,Canada,None,28324,None,None
KIRK,Kirkland's Inc. COMMONSTOCK,37926178.0,United States,2002.0,31955,Consumer Discretionary,Other Specialty Stores
KITT,Nauticus Robotics Inc. Common stock,118294412.0,United States,2021.0,177596,Industrials,Industrial Machinery/Components
KITTW,Nauticus Robotics Inc. Warrant,9976637.0,United States,2021.0,2,Industrials,Industrial Machinery/Components
KKR,KKR & Co. Inc. Common Stock,49255376742.0,United States,None,4649330,Finance,Investment Managers
KKR^C,KKR & Co. Inc. 6.00% Series C Mandatory Convertible Preferred Stock,None,United States,None,44934,None,None
KKRS,KKR Group Finance Co. IX LLC 4.625% Subordinated Notes due 2061,0.0,None,2021.0,164063,None,None
KLAC,KLA Corporation Common Stock,63782397551.0,United States,1980.0,2011853,Technology,Electronic Components
KLIC,Kulicke and Soffa Industries Inc. Common Stock,3289718004.0,Singapore,None,1101180,Technology,Semiconductors
KLR,Kaleyra Inc. Common Stock,58074698.0,United States,2018.0,239459,Technology,EDP Services
KLTR,Kaltura Inc. Common Stock,276914066.0,United States,2021.0,803698,Technology,EDP Services
KLXE,KLX Energy Services Holdings Inc. Common Stock,148323086.0,United States,None,228145,Energy,Oilfield Services/Equipment
KMB,Kimberly-Clark Corporation Common Stock,46450622413.0,United States,None,2594496,Consumer Discretionary,Containers/Packaging
KMDA,Kamada Ltd. Ordinary Shares,238997200.0,Israel,2013.0,18588,Health Care,Biotechnology: Pharmaceutical Preparations
KMF,Kayne Anderson NextGen Energy & Infrastructure Inc.,338877777.0,None,2010.0,194153,Finance,Investment Managers
KMI,Kinder Morgan Inc. Common Stock,38190281346.0,United States,2011.0,24028066,Utilities,Natural Gas Distribution
KMPB,Kemper Corporation 5.875% Fixed-Rate Reset Junior Subordinated Debentures due 2062,1140324289.0,United States,2022.0,17990,Finance,Property-Casualty Insurers
KMPR,Kemper Corporation,2932719537.0,United States,None,845944,Finance,Property-Casualty Insurers
KMT,Kennametal Inc. Common Stock,2311127816.0,United States,None,1400079,Industrials,Industrial Machinery/Components
KMX,CarMax Inc,12588813086.0,United States,None,2315925,Consumer Discretionary,Other Specialty Stores
KN,Knowles Corporation Common Stock,1633861812.0,None,2014.0,1522241,Consumer Staples,Consumer Electronics/Appliances
KNDI,Kandi Technologies Group Inc Common Stock,310114915.0,China,None,212748,Consumer Discretionary,Auto Manufacturing
KNF,Knife Riv Holding Co. Common Stock,0.0,None,2023.0,932520,None,None
KNOP,KNOT Offshore Partners LP Common Units representing Limited Partner Interests,180805500.0,United Kingdom,2013.0,97592,Consumer Discretionary,Marine Transportation
KNSA,Kiniksa Pharmaceuticals Ltd. Class A Common Stock,2175272751.0,United States,2018.0,943796,Health Care,Biotechnology: Pharmaceutical Preparations
KNSL,Kinsale Capital Group Inc. Common Stock,8232620163.0,United States,None,302486,Finance,Property-Casualty Insurers
KNSW,KnightSwan Acquisition Corporation Class A Common Stock,0.0,None,2022.0,130900,Finance,Blank Checks
KNTE,Kinnate Biopharma Inc. Common Stock,158346820.0,United States,2020.0,736740,Health Care,Biotechnology: Pharmaceutical Preparations
KNTK,Kinetik Holdings Inc. Class A Common Stock,4581741975.0,United States,2022.0,348552,Energy,Oil & Gas Production
KNW,Know Labs Inc. Common Stock,58319544.0,None,2022.0,348167,Industrials,Industrial Machinery/Components
KNX,Knight-Swift Transportation Holdings Inc.,8851819100.0,United States,2017.0,3790823,Industrials,Trucking Freight/Courier Services
KO,Coca-Cola Company (The) Common Stock,266696736916.0,United States,None,26735802,Consumer Staples,Beverages (Production/Distribution)
KOD,Kodiak Sciences Inc Common Stock,471206169.0,United States,2018.0,740012,Health Care,Biotechnology: Biological Products (No Diagnostic Substances)
KODK,Eastman Kodak Company Common New,399890590.0,United States,None,967770,Consumer Discretionary,Industrial Machinery/Components
KOF,Coca Cola Femsa S.A.B. de C.V.  American Depositary Shares each representing 10 Units (each Unit consists of 3 Series B Shares and 5 Series L Shares),9258367770.0,Mexico,1993.0,85541,Consumer Staples,Beverages (Production/Distribution)
KOP,Koppers Holdings Inc. Koppers Holdings Inc. Common Stock,711683944.0,United States,2006.0,363415,Basic Materials,Forest Products
KOPN,Kopin Corporation Common Stock,224198089.0,United States,1992.0,1459990,Technology,Semiconductors
KORE,KORE Group Holdings Inc. Common Stock,101796632.0,None,None,199205,Consumer Discretionary,Telecommunications Equipment
KOS,Kosmos Energy Ltd. Common Shares (DE),2856398777.0,Bermuda,2011.0,6147609,Energy,Oil & Gas Production
KOSS,Koss Corporation Common Stock,34277935.0,United States,None,40304,Consumer Staples,Consumer Electronics/Appliances
KPLT,Katapult Holdings Inc. Common Stock,87096092.0,United States,2019.0,278050,Technology,EDP Services
KPLTW,Katapult Holdings Inc. Warrant,4530032.0,United States,2019.0,5259,Technology,EDP Services
KPRX,Kiora Pharmaceuticals Inc.  Common Stock,1578728.0,United States,None,450835,Health Care,Biotechnology: In Vitro & In Vivo Diagnostic Substances
KPTI,Karyopharm Therapeutics Inc. Common Stock,232581314.0,United States,2013.0,24234977,Miscellaneous,Diversified Commercial Services
KR,Kroger Company (The) Common Stock,33125475952.0,United States,None,10576590,Consumer Staples,Food Chains
KRBP,Kiromic BioPharma Inc. Common Stock,3162955.0,United States,2020.0,79159,Health Care, Medicinal Chemicals and Botanical Products
KRC,Kilroy Realty Corporation Common Stock,3603812001.0,United States,1997.0,1492504,Real Estate,Real Estate Investment Trusts
KREF,KKR Real Estate Finance Trust Inc. Common Stock,857469087.0,United States,2017.0,1349934,Real Estate,Real Estate Investment Trusts
KREF^A,KKR Real Estate Finance Trust Inc. 6.50% Series A Cumulative Redeemable Preferred Stock,None,United States,None,20279,None,None
KRG,Kite Realty Group Trust Common Stock,4697961485.0,United States,2004.0,2439473,Real Estate,Real Estate Investment Trusts
KRKR,36Kr Holdings Inc. American Depositary Shares,37037598.0,China,2019.0,11550,Consumer Discretionary,Business Services
KRMD,KORU Medical Systems Inc. Common Stock (DE),170593181.0,United States,None,305734,Health Care,Medical/Dental Instruments
KRNL,Kernel Group Holdings Inc. Class A Ordinary Shares,0.0,United States,2021.0,11,Finance,Blank Checks
KRNLU,Kernel Group Holdings Inc. Units,0.0,United States,2021.0,1100,Finance,Blank Checks
KRNLW,Kernel Group Holdings Inc. Warrants,0.0,United States,2021.0,150,Finance,Blank Checks
KRNT,Kornit Digital Ltd. Ordinary Shares,1556500000.0,Israel,2015.0,687504,Industrials,Industrial Machinery/Components
KRNY,Kearny Financial Corp Common Stock,497608823.0,United States,2005.0,339603,Finance,Savings Institutions
KRO,Kronos Worldwide Inc Common Stock,1025165141.0,United States,None,355028,Industrials,Major Chemicals
KRON,Kronos Bio Inc. Common Stock,94513961.0,United States,2020.0,368250,Health Care, Medicinal Chemicals and Botanical Products
KROS,Keros Therapeutics Inc. Common Stock,1117985898.0,United States,2020.0,532598,Health Care,Biotechnology: Pharmaceutical Preparations
KRP,Kimbell Royalty Partners Common Units Representing Limited Partner Interests,904236478.0,United States,2017.0,1107603,Energy,Oil & Gas Production
KRT,Karat Packaging Inc. Common Stock,363741589.0,United States,2021.0,30444,Industrials,Plastic Products
KRTX,Karuna Therapeutics Inc. Common Stock,8889943559.0,United States,2019.0,483092,Health Care,Biotechnology: Pharmaceutical Preparations
KRUS,Kura Sushi USA Inc. Class A Common Stock,829578620.0,United States,2019.0,164547,Consumer Discretionary,Restaurants
KRYS,Krystal Biotech Inc. Common Stock,3133120183.0,United States,2017.0,727424,Health Care,Biotechnology: Biological Products (No Diagnostic Substances)
KSCP,Knightscope Inc. Class A Common Stock,22837051.0,United States,2022.0,2193034,Telecommunications,Telecommunications Equipment
KSM,DWS Strategic Municipal Income Trust,0.0,United States,1989.0,25647,Finance,Trusts Except Educational Religious and Charitable
KSS,Kohl's Corporation Common Stock,2554882121.0,United States,1992.0,7177936,Consumer Discretionary,Department/Specialty Retail Stores
KT,KT Corporation Common Stock,6170628540.0,South Korea,None,1382073,Telecommunications,Telecommunications Equipment
KTB,Kontoor Brands Inc. Common Stock ,2367074034.0,None,2019.0,948609,Consumer Discretionary,Apparel
KTCC,Key Tronic Corporation Common Stock,60481715.0,United States,1983.0,25367,Technology,Computer peripheral equipment
KTF,DWS Municipal Income Trust,337338011.0,United States,1988.0,60106,Finance,Finance Companies
KTH,Structures Products Cp 8% CorTS Issued by Peco Energy Cap Tr II Preferred Stock,0.0,United States,None,2219,Finance,Investment Managers
KTN,Structured Products Corp 8.205% CorTS 8.205% Corporate Backed Trust Securities (CorTS),0.0,United States,None,617,Finance,Finance: Consumer Services
