Symbol,Name,Market Cap,Country,IPO Year,Volume,Sector,Industry
CVR,Chicago Rivet & Machine Co. Common Stock,25959967.0,United States,1930.0,5997,Industrials,Industrial Machinery/Components
CVRX,CVRx Inc. Common Stock,309423356.0,United States,2021.0,714126,Health Care,Biotechnology: Electromedical & Electrotherapeutic Apparatus
CVS,CVS Health Corporation Common Stock,86818752165.0,United States,None,18203074,Consumer Staples,Retail-Drug Stores and Proprietary Stores
CVU,CPI Aerostructures Inc. Common Stock,47863276.0,United States,2022.0,240390,Industrials,Military/Government/Technical
CVV,CVD Equipment Corporation Common Stock,56396604.0,United States,None,8162,Technology,Industrial Machinery/Components
CVX,Chevron Corporation Common Stock,297884292417.0,United States,None,22872912,Energy,Integrated oil Companies
CW,Curtiss-Wright Corporation Common Stock,6768294357.0,United States,None,311306,Technology,Industrial Machinery/Components
CWAN,Clearwater Analytics Holdings Inc. Class A Common Stock,3832587422.0,None,2021.0,2616725,Technology,Computer Software: Prepackaged Software
CWBC,Community West Bancshares Common Stock,108318853.0,United States,None,7791,Finance,Major Banks
CWBR,CohBar Inc. Common Stock,8459155.0,United States,None,47493,Health Care,Biotechnology: In Vitro & In Vivo Diagnostic Substances
CWCO,Consolidated Water Co. Ltd. Ordinary Shares,353274120.0,Cayman Islands,None,358726,Utilities,Water Supply
CWD,CaliberCos Inc. Class A Common Stock,0.0,United States,2023.0,113147,Finance,Real Estate
CWEN,Clearway Energy Inc. Class C Common Stock,3526380000.0,United States,2015.0,2421940,Utilities,Electric Utilities: Central
CWH,Camping World Holdings Inc. Class A Common Stock,2356016180.0,United States,2016.0,1322789,Consumer Discretionary,Retail-Auto Dealers and Gas Stations
CWK,Cushman & Wakefield plc Ordinary Shares,1991338046.0,None,2018.0,3839030,Finance,Real Estate
CWST,Casella Waste Systems Inc. Class A Common Stock,4504753546.0,United States,1997.0,952054,Utilities,Environmental Services
CWT,California Water Service Group Common Stock,2937847770.0,United States,None,848838,Utilities,Water Supply
CX,Cemex S.A.B. de C.V. Sponsored ADR,10592289158.0,Mexico,None,7171599,Industrials,Building Materials
CXAC,C5 Acquisition Corporation Class A Common Stock,0.0,None,2022.0,825,Finance,Blank Checks
CXAI,CXApp Inc. Class A Common Stock,155192089.0,United States,2021.0,625799,Technology,EDP Services
CXAIW,CXApp Inc. Warrant,6190800.0,United States,2021.0,95337,Technology,EDP Services
CXDO,Crexendo Inc. Common Stock,44672879.0,United States,None,45901,Telecommunications,Telecommunications Equipment
CXE,MFS High Income Municipal Trust Common Stock,109394432.0,United States,1989.0,168062,Finance,Investment Managers
CXH,MFS Investment Grade Municipal Trust Common Stock,65684866.0,United States,1989.0,26388,Finance,Investment Managers
CXM,Sprinklr Inc. Class A Common Stock,3902096313.0,None,2021.0,3265930,Technology,Computer Software: Prepackaged Software
CXT,Crane NXT Co. Common Stock,3123562775.0,United States,None,772783,Industrials,Metal Fabrications
CXW,CoreCivic Inc. Common Stock,1057009942.0,United States,None,2672508,Real Estate,Real Estate Investment Trusts
CYAN,Cyanotech Corporation Common Stock,6773729.0,United States,None,16507,Health Care, Medicinal Chemicals and Botanical Products
CYBN,Cybin Inc. Common Shares,55509347.0,None,None,1697704,Health Care,Pharmaceuticals and Biotechnology
CYBR,CyberArk Software Ltd. Ordinary Shares,6134805600.0,Israel,2014.0,350268,Technology,Computer Software: Prepackaged Software
CYCC,Cyclacel Pharmaceuticals Inc. Common Stock,9529784.0,United States,None,103345,Health Care,Biotechnology: Pharmaceutical Preparations
CYCCP,Cyclacel Pharmaceuticals Inc. 6% Convertible Preferred Stock,137554903.0,United States,None,955,Health Care,Biotechnology: Pharmaceutical Preparations
CYCN,Cyclerion Therapeutics Inc. Common Stock,197603019.0,United States,None,5839,Health Care,Biotechnology: Pharmaceutical Preparations
CYD,China Yuchai International Limited Common Stock,408582900.0,Singapore,1994.0,23523,Industrials,Industrial Machinery/Components
CYH,Community Health Systems Inc. Common Stock,577053042.0,United States,2000.0,6043390,Health Care,Hospital/Nursing Management
CYN,Cyngn Inc. Common Stock,40592188.0,United States,2021.0,220297,Technology,EDP Services
CYRX,CryoPort Inc. Common Stock,989244177.0,United States,None,1257090,Health Care,Biotechnology: Pharmaceutical Preparations
CYT,Cyteir Therapeutics Inc. Common Stock,78128241.0,United States,2021.0,47782,Health Care,Biotechnology: Pharmaceutical Preparations
CYTH,Cyclo Therapeutics Inc. Common Stock,34280577.0,United States,None,142415,Health Care,Biotechnology: Pharmaceutical Preparations
CYTHW,Cyclo Therapeutics Inc. Warrant,5897473.0,United States,None,428,Health Care,Biotechnology: Pharmaceutical Preparations
CYTK,Cytokinetics Incorporated Common Stock,3332118504.0,United States,2004.0,1863366,Health Care,Biotechnology: Pharmaceutical Preparations
CYTO,Altamira Therapeutics Ltd. 0.2 Common Shares (Bermuda),5394882.0,Bermuda,2014.0,335312,Health Care,Biotechnology: Pharmaceutical Preparations
CZFS,Citizens Financial Services Inc. Common Stock,344170817.0,United States,None,33938,Finance,Major Banks
CZNC,Citizens & Northern Corp Common Stock,322736984.0,United States,None,55142,Finance,Major Banks
CZOO,Cazoo Group Ltd Class A Ordinary Shares,52292000.0,None,None,62328,Consumer Discretionary,Retail-Auto Dealers and Gas Stations
CZR,Caesars Entertainment Inc. Common Stock,10510571419.0,United States,None,3797160,Consumer Discretionary,Hotels/Resorts
CZWI,Citizens Community Bancorp Inc. Common Stock,93153192.0,United States,2006.0,18761,Finance,Savings Institutions
D,Dominion Energy Inc. Common Stock,44580755929.0,United States,None,9867712,None,None
DAC,Danaos Corporation Common Stock,1329465500.0,Greece,2006.0,173067,Consumer Discretionary,Marine Transportation
DADA,Dada Nexus Limited American Depositary Shares,1678508928.0,China,2020.0,2618184,Technology,Computer Software: Programming Data Processing
DAIO,Data I/O Corporation Common Stock,39681342.0,United States,1981.0,9765,Technology,Industrial Machinery/Components
DAKT,Daktronics Inc. Common Stock,305984349.0,United States,1994.0,343516,Consumer Discretionary,Miscellaneous manufacturing industries
DAL,Delta Air Lines Inc. Common Stock,27501844298.0,United States,None,12212989,Consumer Discretionary,Air Freight/Delivery Services
DALN,DallasNews Corporation Series A Common Stock,21249385.0,United States,None,41541,Consumer Discretionary,Newspapers/Magazines
DALS,DA32 Life Science Tech Acquisition Corp. Class A Common Stock,262912500.0,United States,2021.0,17774,Finance,Blank Checks
DAN,Dana Incorporated Common Stock ,2426189267.0,United States,None,27817879,Consumer Discretionary,Auto Parts:O.E.M.
DAO,Youdao Inc. American Depositary Shares each representing one Class A Ordinary Share,647180590.0,None,2019.0,372357,Consumer Discretionary,Educational Services
DAR,Darling Ingredients Inc. Common Stock,10390818620.0,United States,1997.0,2068034,Consumer Staples,Packaged Foods
DARE,Dare Bioscience Inc. Common Stock,81970586.0,United States,2014.0,413318,Health Care,Biotechnology: Pharmaceutical Preparations
DASH,DoorDash Inc. Class A Common Stock,28466225746.0,None,2020.0,3658025,Industrials,Industrial Machinery/Components
DATS,DatChat Inc. Common Stock,14310889.0,United States,2021.0,1934964,Technology,Computer Software: Prepackaged Software
DAVA,Endava plc American Depositary Shares (each representing one Class A Ordinary Share),3063546064.0,United Kingdom,2018.0,487892,Technology,EDP Services
DAVE,Dave Inc. Class A Common Stock,67924694.0,United States,None,23032,Technology,Retail: Computer Software & Peripheral Equipment
DAVEW,Dave Inc. Warrants,347965.0,United States,None,1989,Technology,Retail: Computer Software & Peripheral Equipment
DAWN,Day One Biopharmaceuticals Inc. Common Stock,974837387.0,United States,2021.0,3508943,Health Care,Biotechnology: Pharmaceutical Preparations
DB,Deutsche Bank AG Common Stock,21256800000.0,Germany,None,3685222,Finance,Major Banks
DBGI,Digital Brands Group Inc. Common Stock,4248203.0,United States,2021.0,46000,Consumer Discretionary,Clothing/Shoe/Accessory Stores
DBGIW,Digital Brands Group Inc. Warrant,35610815.0,United States,2021.0,15,Consumer Discretionary,Clothing/Shoe/Accessory Stores
DBI,Designer Brands Inc. Class A Common Stock,600806443.0,United States,None,5105329,Consumer Discretionary,Clothing/Shoe/Accessory Stores
DBL,DoubleLine Opportunistic Credit Fund Common Shares of Beneficial Interest,0.0,United States,2012.0,32979,None,None
DBRG,DigitalBridge Group Inc.,2246027775.0,United States,2014.0,2710856,Real Estate,Real Estate Investment Trusts
DBRG^H,DigitalBridge Group Inc. 7.125% Series H ,None,United States,None,204066,None,None
DBRG^I,DigitalBridge Group Inc. 7.15% Series I ,None,United States,None,211300,None,None
DBRG^J,DigitalBridge Group Inc. 7.125% Series J ,None,United States,None,216142,None,None
DBTX,Decibel Therapeutics Inc. Common Stock,106313682.0,United States,2021.0,26274,Health Care,Biotechnology: Pharmaceutical Preparations
DBVT,DBV Technologies S.A. American Depositary Shares,370940437.0,France,2014.0,185697,Health Care,Biotechnology: Biological Products (No Diagnostic Substances)
DBX,Dropbox Inc. Class A Common Stock,9080863183.0,United States,2018.0,47220632,Technology,Computer Software: Prepackaged Software
DC,Dakota Gold Corp. Common Stock,243265680.0,None,2022.0,441438,Basic Materials,Precious Metals
DCBO,Docebo Inc. Common Shares,1244678800.0,Canada,None,23102,Technology,Computer Software: Prepackaged Software
DCF,BNY Mellon Alcentra Global Credit Income 2024 Target Term Fund Inc. Common Stock,0.0,None,2017.0,27751,Finance,Finance/Investors Services
DCFC,Tritium DCFC Limited Ordinary Shares,172593900.0,Australia,None,745175,Technology,Electronic Components
DCFCW,Tritium DCFC Limited Warrant,56660189.0,Australia,None,9074,Technology,Electronic Components
DCGO,DocGo Inc. Common Stock,932299803.0,United States,2020.0,913143,Health Care,Managed Health Care
DCI,Donaldson Company Inc. Common Stock,7486705047.0,United States,None,1084706,Industrials,Pollution Control Equipment
DCO,Ducommun Incorporated Common Stock,541694512.0,United States,None,250868,Industrials,Military/Government/Technical
DCOM,Dime Community Bancshares Inc. Common Stock,610724490.0,United States,None,607021,Finance,Major Banks
DCOMP,Dime Community Bancshares Inc. Fixed-Rate Non-Cumulative Perpetual Preferred Stock Series A,535705843.0,United States,None,8831,Finance,Major Banks
DCP^C,DCP Midstream LP 7.95% Series C Fixed-to-Floating Rate Cumulative Redeemable Perpetual Preferred Units,None,United States,None,6115,None,None
DCPH,Deciphera Pharmaceuticals Inc. Common Stock,1133109430.0,United States,2017.0,851012,Health Care,Biotechnology: Pharmaceutical Preparations
DCTH,Delcath Systems Inc. Common Stock,66804914.0,United States,None,309475,Health Care,Medical/Dental Instruments
DD,DuPont de Nemours Inc. Common Stock,31860354145.0,None,2017.0,7877298,Industrials,Major Chemicals
DDD,3D Systems Corporation Common Stock,1238105088.0,United States,None,3887136,Technology,Computer peripheral equipment
DDI,DoubleDown Interactive Co. Ltd. American Depository Shares,463240423.0,South Korea,2021.0,11913,Technology,EDP Services
DDL,Dingdong (Cayman) Limited American Depositary Shares (each two representing three Ordinary Shares),716033076.0,None,2021.0,555064,Consumer Discretionary,Catalog/Specialty Distribution
DDOG,Datadog Inc. Class A Common Stock,30819537187.0,United States,2019.0,4529646,Technology,Computer Software: Prepackaged Software
DDS,Dillard's Inc. Common Stock,5832618422.0,United States,None,141877,Consumer Discretionary,Department/Specialty Retail Stores
DDT,Dillard's Capital Trust I,451224048.0,United States,None,6725,Consumer Discretionary,Department/Specialty Retail Stores
DE,Deere & Company Common Stock,119513912436.0,United States,None,2119868,Industrials,Industrial Machinery/Components
DEA,Easterly Government Properties Inc. Common Stock,1384972306.0,United States,2015.0,1380951,Real Estate,Real Estate Investment Trusts
DECA,Denali Capital Acquisition Corp. Class A Ordinary Shares,0.0,United States,2022.0,15529,Finance,Blank Checks
DECK,Deckers Outdoor Corporation Common Stock,13412676241.0,United States,1993.0,490392,Consumer Discretionary,Shoe Manufacturing
DEI,Douglas Emmett Inc. Common Stock,2166771542.0,United States,2006.0,36918263,Real Estate,Real Estate Investment Trusts
DELL,Dell Technologies Inc. Class C Common Stock ,36318945049.0,None,2018.0,9352065,Technology,Computer Manufacturing
DEN,Denbury Inc. Common Stock,4500813691.0,None,2020.0,840323,Energy,Oil & Gas Production
DENN,Denny's Corporation Common Stock,666920970.0,United States,None,722909,Consumer Discretionary,Restaurants
DEO,Diageo plc Common Stock,108311893027.0,United Kingdom,None,590539,Consumer Staples,Beverages (Production/Distribution)
DERM,Journey Medical Corporation Common Stock,40965641.0,United States,2021.0,113369,Health Care,Biotechnology: Pharmaceutical Preparations
DESP,Despegar.com Corp. Ordinary Shares,463080600.0,None,2017.0,321488,Consumer Discretionary,Transportation Services
DFFN,Diffusion Pharmaceuticals Inc. Common Stock,7670494.0,United States,None,4870,Health Care,Biotechnology: Pharmaceutical Preparations
DFH,Dream Finders Homes Inc. Class A Common Stock,2277064686.0,United States,2022.0,805009,Consumer Discretionary,Homebuilding
DFIN,Donnelley Financial Solutions Inc. Common Stock ,1335755711.0,None,2016.0,337507,Consumer Discretionary,Other Consumer Services
DFLI,Dragonfly Energy Holdings Corp. Common Stock (NV),128020581.0,United States,2021.0,3357382,Technology,Electronic Components
DFLIW,Dragonfly Energy Holdings Corp. Warrant,10094813.0,United States,2021.0,2020,Technology,Electronic Components
DFP,Flaherty & Crumrine Dynamic Preferred and Income Fund Inc. Common Stock,0.0,None,2013.0,50833,Finance,Investment Managers
DFS,Discover Financial Services Common Stock,29285056526.0,United States,None,5918071,Finance,Finance: Consumer Services
DG,Dollar General Corporation Common Stock,36003904941.0,United States,2009.0,4781069,Consumer Discretionary,Department/Specialty Retail Stores
DGHI,Digihost Technology Inc. Common Subordinate Voting Shares,42261773.0,Canada,None,71295,Finance,Finance: Consumer Services
DGICA,Donegal Group Inc. Class A Common Stock,503023559.0,United States,None,72714,Finance,Property-Casualty Insurers
DGICB,Donegal Group Inc. Class B Common Stock,457922625.0,United States,1986.0,5123,Finance,Property-Casualty Insurers
DGII,Digi International Inc. Common Stock,1363079988.0,United States,1989.0,523238,Technology,Computer peripheral equipment
DGLY,Digital Ally Inc. Common Stock,12646478.0,United States,None,24912,Technology,Radio And Television Broadcasting And Communications Equipment
DGX,Quest Diagnostics Incorporated Common Stock,15524474704.0,United States,None,2673547,Health Care,Medical Specialities
DH,Definitive Healthcare Corp. Class A Common Stock,1190319818.0,United States,2021.0,700345,Technology,Computer Software: Prepackaged Software
DHC,Diversified Healthcare Trust Common Shares of Beneficial Interest,615983940.0,United States,None,5553515,Real Estate,Real Estate Investment Trusts
DHCA,DHC Acquisition Corp. Class A ordinary share,0.0,United States,2021.0,405,Finance,Blank Checks
DHCAW,DHC Acquisition Corp. Warrant,0.0,United States,2021.0,6320,Finance,Blank Checks
DHCNI,Diversified Healthcare Trust 5.625% Senior Notes due 2042,3043967331.0,United States,None,18501,Real Estate,Real Estate Investment Trusts
DHCNL,Diversified Healthcare Trust 6.25% Senior Notes Due 2046,3283649798.0,United States,None,9973,Real Estate,Real Estate Investment Trusts
DHF,BNY Mellon High Yield Strategies Fund Common Stock,0.0,United States,1998.0,72262,Finance,Finance Companies
DHI,D.R. Horton Inc. Common Stock,39700684421.0,United States,None,6318626,Consumer Discretionary,Homebuilding
DHIL,Diamond Hill Investment Group Inc. Class A Common Stock,529279236.0,United States,None,20206,Finance,Investment Managers
DHR,Danaher Corporation Common Stock,178423927180.0,United States,None,6399960,Industrials,Industrial Machinery/Components
DHT,DHT Holdings Inc.,1421561000.0,Jersey,2005.0,2987548,Consumer Discretionary,Marine Transportation
DHX,DHI Group Inc. Common Stock,190670485.0,United States,2007.0,350707,Consumer Discretionary,Business Services
DHY,Credit Suisse High Yield Bond Fund Common Stock,0.0,United States,1998.0,259025,Finance,Finance/Investors Services
DIAX,Nuveen Dow 30SM Dynamic Overwrite Fund Common Shares of Beneficial Interest,0.0,None,2014.0,155278,Finance,Finance Companies
DIBS,1stdibs.com Inc. Common Stock,142628739.0,United States,2021.0,289862,Consumer Discretionary,Catalog/Specialty Distribution
DICE,DICE Therapeutics Inc. Common Stock,1615680031.0,United States,2021.0,528564,Health Care,Biotechnology: Pharmaceutical Preparations
DIN,Dine Brands Global Inc. Common Stock,930895652.0,United States,None,502690,Consumer Discretionary,Restaurants
DINO,HF Sinclair Corporation Common Stock,5816249246.0,United States,1960.0,3655436,Energy,Natural Gas Distribution
DIOD,Diodes Incorporated Common Stock,4246496356.0,United States,None,694943,Technology,Semiconductors
DIS,Walt Disney Company (The) Common Stock,166869491504.0,United States,None,22665509,Consumer Discretionary,Movies/Entertainment
DISA,Disruptive Acquisition Corporation I Class A Ordinary Shares,0.0,United States,2021.0,9,Finance,Blank Checks
DISAW,Disruptive Acquisition Corporation I Warrant,0.0,United States,2021.0,667,Finance,Blank Checks
DISH,DISH Network Corporation Class A Common Stock,3445972052.0,United States,1995.0,79250932,Telecommunications,Cable & Other Pay Television Services
DISTR,Distoken Acquisition Corporation Right,0.0,China,2023.0,2,Finance,Blank Checks
DIT,AMCON Distributing Company Common Stock,124355193.0,United States,1999.0,2549,Consumer Discretionary,Food Distributors
DJCO,Daily Journal Corp. (S.C.) Common Stock,388045927.0,United States,None,5824,Consumer Discretionary,Newspapers/Magazines
DK,Delek US Holdings Inc. Common Stock,1463890017.0,United States,2017.0,1474227,Energy,Integrated oil Companies
DKDCA,Data Knights Acquisition Corp. Class A Common Stock,82554514.0,United Kingdom,2021.0,6,Health Care,Biotechnology: Commercial Physical & Biological Resarch
DKDCW,Data Knights Acquisition Corp. Warrant,135509.0,United Kingdom,2021.0,791,Health Care,Biotechnology: Commercial Physical & Biological Resarch
DKL,Delek Logistics Partners L.P. Common Units representing Limited Partner Interests,2482038835.0,United States,2012.0,133018,Energy,Oil & Gas Production
DKNG,DraftKings Inc. Class A Common Stock,19649280085.0,United States,2019.0,14103874,Consumer Discretionary,Services-Misc. Amusement & Recreation
DKS,Dick's Sporting Goods Inc Common Stock,11567008147.0,United States,2002.0,1463644,Consumer Discretionary,Other Specialty Stores
DLA,Delta Apparel Inc. Common Stock,78481434.0,United States,2000.0,8000,Consumer Staples,Apparel
DLB,Dolby Laboratories Common Stock,8020604378.0,United States,2005.0,465099,Miscellaneous,Multi-Sector Companies
DLHC,DLH Holdings Corp.,144723314.0,United States,None,29767,Consumer Discretionary,Professional Services
DLNG,Dynagas LNG Partners LP Common Units,99734089.0,Greece,None,26470,Consumer Discretionary,Marine Transportation
DLNG^A,Dynagas LNG Partners LP 9.00% Series A Cumulative Redeemable Preferred Units,None,Greece,None,4735,None,None
DLNG^B,Dynagas LNG Partners LP 8.75% Series B Fixed to Floating Rate Cumulative Redeemable Perpetual Preferred Units liquidation preference $25.00 per Uni,None,Greece,None,822,None,None
DLO,DLocal Limited Class A Common Shares,2078250200.0,Uruguay,2021.0,2134480,Consumer Discretionary,Business Services
DLPN,Dolphin Entertainment Inc. Common Stock,27085132.0,United States,None,85508,Consumer Discretionary,Other Consumer Services
DLR,Digital Realty Trust Inc. Common Stock,30643886716.0,United States,2004.0,4570435,Real Estate,Real Estate Investment Trusts
DLR^J,Digital Realty Trust Inc. 5.250% Series J Cumulative Redeemable Preferred Stock,None,United States,None,8760,None,None
DLR^K,Digital Realty Trust Inc. 5.850% Series K Cumulative Redeemable Preferred Stock par value $0.01 per share,None,United States,None,9041,None,None
DLR^L,Digital Realty Trust Inc. 5.200% Series L Cumulative Redeemable Preferred Stock,None,United States,None,20496,None,None
DLTH,Duluth Holdings Inc. Class B Common Stock,200096772.0,United States,2015.0,89738,Consumer Discretionary,Clothing/Shoe/Accessory Stores
DLTR,Dollar Tree Inc. Common Stock,30020895510.0,United States,1995.0,2592595,Consumer Discretionary,Department/Specialty Retail Stores
DLX,Deluxe Corporation Common Stock,745348433.0,United States,None,545558,Consumer Discretionary,Publishing
DLY,DoubleLine Yield Opportunities Fund Common Shares of Beneficial Interest,686583555.0,None,2020.0,187584,Finance,Investment Managers
DM,Desktop Metal Inc. Class A Common Stock,665422914.0,None,2019.0,9235263,Technology,Computer peripheral equipment
DMA,Destra Multi-Alternative Fund Common Stock,0.0,None,2022.0,86810,Finance,Trusts Except Educational Religious and Charitable
DMAC,DiaMedica Therapeutics Inc. Common Stock,94268045.0,United States,2018.0,190401,Health Care,Pharmaceuticals and Biotechnology
DMAQ,Deep Medicine Acquisition Corp. Class A Common Stock,0.0,United States,2021.0,350,Industrials,Consumer Electronics/Appliances
DMAQR,Deep Medicine Acquisition Corp. Rights,0.0,United States,2021.0,30,None,None
DMB,BNY Mellon Municipal Bond Infrastructure Fund Inc. Common Stock,0.0,None,2013.0,38084,Finance,Trusts Except Educational Religious and Charitable
DMF,BNY Mellon Municipal Income Inc. Common Stock,0.0,United States,1988.0,109836,Finance,Finance/Investors Services
DMLP,Dorchester Minerals L.P. Common Units Representing Limited Partnership Interests,1116610446.0,United States,None,287013,Energy,Oil & Gas Production
DMO,Western Asset Mortgage Opportunity Fund Inc. Common Stock,0.0,United States,2010.0,25111,Finance,Trusts Except Educational Religious and Charitable
DMRC,Digimarc Corporation Common Stock,564617811.0,United States,None,118818,Technology,EDP Services
DMS,Digital Media Solutions Inc. Class A Ordinary Shares,36778856.0,United States,2018.0,24542,Consumer Discretionary,Advertising
DMTK,DermTech Inc. Common Stock,85808154.0,United States,2017.0,288021,Health Care,Medical Specialities
DMYY,dMY Squared Technology Group Inc. Class A Common Stock,0.0,None,2022.0,100,Finance,Blank Checks
DNA,Ginkgo Bioworks Holdings Inc. Class A Common Stock,3962448961.0,United States,2021.0,27723445,Health Care,Biotechnology: Biological Products (No Diagnostic Substances)
DNAB,Social Capital Suvretta Holdings Corp. II Class A Ordinary Shares,0.0,United States,2021.0,6295,Finance,Blank Checks
DNAD,Social Capital Suvretta Holdings Corp. IV Class A Ordinary Shares,0.0,United States,2021.0,889,Finance,Blank Checks
DNB,Dun & Bradstreet Holdings Inc. Common Stock,5144654748.0,United States,2020.0,8140976,Finance,Finance: Consumer Services
DNLI,Denali Therapeutics Inc. Common Stock,4249031828.0,United States,2017.0,1429371,Health Care,Biotechnology: Biological Products (No Diagnostic Substances)
DNMR,Danimer Scientific Inc. Common Stock,295621290.0,None,2020.0,895537,Industrials,Major Chemicals
DNN,Denison Mines Corp Ordinary Shares (Canada),1044226918.0,Canada,None,2180845,Basic Materials,Other Metals and Minerals
DNOW,NOW Inc. Common Stock,1067589712.0,None,2014.0,2620663,Industrials,Metal Fabrications
DNP,DNP Select Income Fund Inc. Common Stock,0.0,United States,1987.0,453210,Finance,Investment Managers
DNUT,Krispy Kreme Inc. Common Stock,2423762000.0,United States,2021.0,1334011,Consumer Staples,Food Chains
DO,Diamond Offshore Drilling Inc. Common Stock,1238593147.0,United States,2022.0,1326776,Energy,Oil & Gas Production
DOC,Physicians Realty Trust Common Shares of Beneficial Interest,3447243192.0,United States,2013.0,4374069,Real Estate,Real Estate Investment Trusts
DOCN,DigitalOcean Holdings Inc. Common Stock,3884659406.0,United States,2021.0,2828065,Technology,Retail: Computer Software & Peripheral Equipment
DOCS,Doximity Inc. Class A Common Stock,6334449504.0,None,2021.0,21385636,Technology,Retail: Computer Software & Peripheral Equipment
DOCU,DocuSign Inc. Common Stock,10897680235.0,United States,2018.0,5766844,Technology,EDP Services
DOGZ,Dogness (International) Corporation Class A Common Stock,25074300.0,China,2017.0,18459,Consumer Discretionary,Miscellaneous manufacturing industries
DOLE,Dole plc Ordinary Shares,1317212000.0,None,2021.0,646619,Consumer Staples,Farming/Seeds/Milling
DOMA,Doma Holdings Inc. Common Stock,87428730.0,None,2021.0,1095143,Finance,Real Estate
DOMH,Dominari Holdings Inc. Common Stock,13915511.0,United States,None,15570,Health Care,Biotechnology: Pharmaceutical Preparations
DOMO,Domo Inc. Class B Common Stock,548157710.0,United States,2018.0,1759098,Technology,Computer Software: Prepackaged Software
DOOO,BRP Inc. (Recreational Products) Common Subordinate Voting Shares,6511493927.0,Canada,None,68053,Consumer Discretionary,Industrial Specialties
DOOR,Masonite International Corporation Ordinary Shares (Canada),2182726849.0,Canada,None,276167,Basic Materials,Forest Products
DORM,Dorman Products Inc. Common Stock,2629179306.0,United States,None,380121,Consumer Discretionary,Auto Parts:O.E.M.
DOUG,Douglas Elliman Inc. Common Stock,205975094.0,None,2021.0,16842293,Real Estate,Building operators
DOV,Dover Corporation Common Stock,20660232254.0,United States,None,1530057,Industrials,Industrial Machinery/Components
DOW,Dow Inc. Common Stock ,37600855140.0,None,2019.0,9535909,Industrials,Major Chemicals
DOX,Amdocs Limited Ordinary Shares,11792032000.0,Guernsey,None,926019,Technology,EDP Services
