Symbol,Name,Market Cap,Country,IPO Year,Volume,Sector,Industry
PUMP,ProPetro Holding Corp. Common Stock,906870858.0,United States,2017.0,2324776,Energy,Oilfield Services/Equipment
PUYI,Puyi Inc. American Depository Shares,283478977.0,China,2019.0,7,Finance,Investment Managers
PVBC,Provident Bancorp Inc. (MD) Common Stock,144357303.0,United States,2015.0,114465,Finance,Major Banks
PVH,PVH Corp. Common Stock,6018479628.0,United States,None,1413552,Consumer Discretionary,Apparel
PVL,Permianville Royalty Trust Trust Units ,80850000.0,United States,2011.0,64344,Energy,Oil & Gas Production
PW,Power REIT (MD) Common Stock,6101390.0,United States,1998.0,8073,Real Estate,Real Estate Investment Trusts
PW^A,Power REIT 7.75% Series A Cumulative Perpetual Preferred Stock,None,United States,None,347,None,None
PWFL,PowerFleet Inc. Common Stock,118369460.0,United States,None,79649,Telecommunications,Telecommunications Equipment
PWOD,Penns Woods Bancorp Inc. Common Stock,189640020.0,United States,None,22469,Finance,Major Banks
PWP,Perella Weinberg Partners Class A Common Stock,837254939.0,United States,2020.0,800418,Finance,Finance: Consumer Services
PWR,Quanta Services Inc. Common Stock,26995396126.0,United States,None,1752617,Industrials,Engineering & Construction
PWSC,PowerSchool Holdings Inc. Class A Common Stock,3874043898.0,United States,2021.0,1436925,Technology,Computer Software: Prepackaged Software
PWUP,PowerUp Acquisition Corp. Class A Ordinary Shares,0.0,United States,2022.0,200,Finance,Blank Checks
PWUPU,PowerUp Acquisition Corp. Unit,0.0,United States,2022.0,805,Finance,Blank Checks
PWUPW,PowerUp Acquisition Corp. Warrant,0.0,United States,2022.0,3212,Finance,Blank Checks
PX,P10 Inc. Class A Common Stock,1344946530.0,United States,2021.0,273466,Finance,Investment Managers
PXD,Pioneer Natural Resources Company Common Stock,48336509052.0,United States,None,4240708,Energy,Oil & Gas Production
PXLW,Pixelworks Inc.  Common Stock,100852702.0,United States,2000.0,129723,Technology,Semiconductors
PXMD,PaxMedica Inc. Common Stock,15204256.0,United States,2022.0,321918,Health Care, Medicinal Chemicals and Botanical Products
PXS,Pyxis Tankers Inc. Common Stock,41495000.0,Greece,None,31305,Consumer Discretionary,Marine Transportation
PXSAP,Pyxis Tankers Inc. 7.75% Series A Cumulative Convertible Preferred Shares,294213219.0,Greece,None,516,Consumer Discretionary,Marine Transportation
PXSAW,Pyxis Tankers Inc. Warrant,13413592.0,Greece,None,103,Consumer Discretionary,Marine Transportation
PYCR,Paycor HCM Inc. Common Stock,4122094655.0,United States,2021.0,921400,Technology,Computer Software: Prepackaged Software
PYN,PIMCO New York Municipal Income Fund III Common Shares of Beneficial Interest,0.0,United States,2002.0,54989,Finance,Investment Managers
PYPD,PolyPid Ltd. Ordinary Shares,8209538.0,Israel,2020.0,23173,Health Care,Medical/Dental Instruments
PYPL,PayPal Holdings Inc. Common Stock,74116878894.0,United States,None,29691391,Consumer Discretionary,Business Services
PYR,PyroGenesis Canada Inc. Common Shares,137506904.0,Canada,None,24126,None,None
PYT,PPlus Tr GSC-2 Tr Ctf Fltg Rate,0.0,United States,None,1368,Finance,Finance: Consumer Services
PYXS,Pyxis Oncology Inc. Common Stock,111293785.0,United States,2021.0,357049,Health Care,Biotechnology: Pharmaceutical Preparations
PZC,PIMCO California Municipal Income Fund III Common Shares of Beneficial Interest,0.0,United States,2002.0,22323,Finance,Investment Managers
PZG,Paramount Gold Nevada Corp. Common Stock,17922142.0,United States,2015.0,615300,Basic Materials,Precious Metals
PZZA,Papa John's International Inc. Common Stock,2431896714.0,United States,1993.0,1147170,Consumer Discretionary,Restaurants
QBTS,D-Wave Quantum Inc. Common Shares,151528788.0,None,2022.0,2610490,Technology,Retail: Computer Software & Peripheral Equipment
QCOM,QUALCOMM Incorporated Common Stock,136665520000.0,United States,1991.0,12904175,Technology,Radio And Television Broadcasting And Communications Equipment
QCRH,QCR Holdings Inc. Common Stock,719546034.0,United States,None,131744,Finance,Major Banks
QD,Qudian Inc. American Depositary Shares each representing one Class A Ordinary Share,443590483.0,China,2017.0,861230,Finance,Finance: Consumer Services
QDEL,QuidelOrtho Corporation Common Stock,5838424904.0,United States,None,1289116,Health Care,Medical Specialities
QDRO,Quadro Acquisition One Corp. Class A Ordinary Shares,0.0,United States,2021.0,124,Finance,Blank Checks
QDROW,Quadro Acquisition One Corp.  Warrant,0.0,United States,2021.0,19442,Finance,Blank Checks
QFIN,Qifu Technology Inc. American Depositary Shares,2603317996.0,China,2018.0,824020,Finance,Finance: Consumer Services
QFTA,Quantum FinTech Acquisition Corporation Common Stock,0.0,None,2021.0,11,Finance,Blank Checks
QGEN,Qiagen N.V. Common Shares ,10648187200.0,Netherlands,None,723989,Health Care,Biotechnology: Biological Products (No Diagnostic Substances)
QH,Quhuo Limited American Depository Shares,15048995.0,China,2020.0,277674,Consumer Discretionary,Business Services
QIPT,Quipt Home Medical Corp. Common Shares,191554900.0,United States,None,212831,Health Care,Misc Health and Biotechnology Services
QLGN,Qualigen Therapeutics Inc. Common Stock,4799840.0,United States,2015.0,18349,Health Care,Biotechnology: Pharmaceutical Preparations
QLI,Qilian International Holding Group Ltd. Ordinary Shares,32879275.0,China,2021.0,154,Health Care,Biotechnology: Pharmaceutical Preparations
QLYS,Qualys Inc. Common Stock,4833718365.0,United States,2012.0,631574,Technology,Computer Software: Prepackaged Software
QMCO,Quantum Corporation Common Stock,105879064.0,United States,None,419947,Technology,Electronic Components
QNCX,Quince Therapeutics Inc. Common Stock,56218340.0,United States,2019.0,127167,Health Care,Biotechnology: Biological Products (No Diagnostic Substances)
QNRX,Quoin Pharmaceuticals Ltd. American Depositary Shares,6291732.0,Israel,2016.0,97495,Health Care,Medical/Dental Instruments
QNST,QuinStreet Inc. Common Stock,455130042.0,United States,2010.0,858577,Consumer Discretionary,Advertising
QOMO,Qomolangma Acquisition Corp. Common Stock,0.0,United States,2022.0,38400,Finance,Blank Checks
QOMOW,Qomolangma Acquisition Corp. Warrant,0.0,United States,2022.0,1200,Finance,Blank Checks
QQQX,Nuveen NASDAQ 100 Dynamic Overwrite Fund Shares of Beneficial Interest,0.0,United States,None,115295,Finance,Finance Companies
QRHC,Quest Resource Holding Corporation Common Stock,113611231.0,United States,None,60891,Utilities,Environmental Services
QRTEA,Qurate Retail Inc. Series A Common Stock ,362207238.0,United States,None,33779378,Consumer Discretionary,Catalog/Specialty Distribution
QRTEB,Qurate Retail Inc. Series B Common Stock ,2572759569.0,United States,None,10888,Consumer Discretionary,Catalog/Specialty Distribution
QRTEP,Qurate Retail Inc. 8.0% Fixed Rate Cumulative Redeemable Preferred Stock,12861421686.0,United States,None,74066,Consumer Discretionary,Catalog/Specialty Distribution
QRVO,Qorvo Inc. Common Stock,10250630730.0,United States,None,3468726,Technology,Semiconductors
QS,QuantumScape Corporation Class A Common Stock,3380704760.0,United States,2020.0,8250205,Consumer Discretionary,Auto Parts:O.E.M.
QSG,QuantaSing Group Limited American Depositary Shares,500665892.0,China,2023.0,6864,Consumer Discretionary,Educational Services
QSI,Quantum-Si Incorporated Class A Common Stock,206585386.0,United States,2020.0,1916879,Health Care,Biotechnology: Pharmaceutical Preparations
QSIAW,Quantum-Si Incorporated Warrant,28299368.0,United States,2020.0,601,Health Care,Biotechnology: Pharmaceutical Preparations
QSR,Restaurant Brands International Inc. Common Shares,23788959177.0,Canada,2014.0,732881,Consumer Discretionary,Restaurants
QTRX,Quanterix Corporation Common Stock,844314878.0,United States,2017.0,356707,Industrials,Biotechnology: Laboratory Analytical Instruments
QTWO,Q2 Holdings Inc. Common Stock,1733724438.0,None,2014.0,2096323,Technology,EDP Services
QUAD,Quad Graphics Inc Class A Common Stock,191336854.0,United States,None,193653,Consumer Discretionary,Publishing
QUBT,Quantum Computing Inc. Common Stock,104570589.0,United States,None,1561882,Technology,Computer Software: Prepackaged Software
QUIK,QuickLogic Corporation Common Stock,105135429.0,United States,1999.0,50160,Technology,Semiconductors
QUOT,Quotient Technology Inc. Common Stock,329362627.0,None,2014.0,1092577,Consumer Discretionary,Advertising
QURE,uniQure N.V. Ordinary Shares,925431000.0,Netherlands,2014.0,1557581,Health Care,Biotechnology: Pharmaceutical Preparations
QVCC,QVC Inc. 6.250% Senior Secured Notes due 2068,11.0,United States,2019.0,56951,Consumer Discretionary,Catalog/Specialty Distribution
QVCD,QVC Inc. 6.375% Senior Secured Notes due 2067,0.0,United States,2018.0,25547,Consumer Discretionary,Catalog/Specialty Distribution
R,Ryder System Inc. Common Stock,3824451087.0,United States,None,1079378,Consumer Discretionary,Rental/Leasing Companies
RA,Brookfield Real Assets Income Fund Inc. Common Stock,0.0,None,2016.0,131153,Finance,Investment Managers
RACE,Ferrari N.V. Common Shares,59731238400.0,None,2015.0,294924,Consumer Discretionary,Auto Manufacturing
RAD,Rite Aid Corporation Common Stock,103826353.0,United States,None,2562980,Consumer Staples,Retail-Drug Stores and Proprietary Stores
RADI,Radius Global Infrastructure Inc. Class A Common Stock,1481007634.0,United States,None,1706313,Consumer Discretionary,Telecommunications Equipment
RAIL,FreightCar America Inc. Common Stock,48504738.0,United States,2005.0,40287,Industrials,Railroads
RAIN,Rain Oncology Inc. Common Stock,49090290.0,United States,2021.0,1080343,Health Care,Biotechnology: Pharmaceutical Preparations
RAMP,LiveRamp Holdings Inc. Common Stock,1727794481.0,United States,2018.0,1087255,Technology,EDP Services
RAND,Rand Capital Corporation Common Stock,33579341.0,United States,None,188,Finance,Finance/Investors Services
RANI,Rani Therapeutics Holdings Inc. Class A Common Stock,223401116.0,United States,2021.0,58454,Health Care, Medicinal Chemicals and Botanical Products
RAPT,RAPT Therapeutics Inc. Common Stock,692395885.0,United States,2019.0,889121,Health Care,Biotechnology: Pharmaceutical Preparations
RARE,Ultragenyx Pharmaceutical Inc. Common Stock,3418922225.0,United States,2014.0,1000366,Health Care,Biotechnology: Pharmaceutical Preparations
RAVE,Rave Restaurant Group Inc. Common Stock,29520970.0,United States,None,46038,Consumer Discretionary,Food Distributors
RAYA,Erayak Power Solution Group Inc. Class A Ordinary Shares,28710000.0,China,2022.0,30765,Consumer Discretionary,Metal Fabrications
RBA,RB Global Inc. Common Stock,10378301526.0,Canada,None,12523631,Consumer Discretionary,Business Services
RBB,RBB Bancorp Common Stock,244818520.0,United States,2017.0,67887,Finance,Major Banks
RBBN,Ribbon Communications Inc. Common Stock,483046052.0,United States,None,972322,Technology,EDP Services
RBC,RBC Bearings Incorporated Common Stock,6067713252.0,United States,2022.0,315828,Industrials,Metal Fabrications
RBCAA,Republic Bancorp Inc. Class A Common Stock,901095262.0,United States,1998.0,45836,Finance,Major Banks
RBCP,RBC Bearings Incorporated 5.00% Series A Mandatory Convertible Preferred Stock,3062156174.0,United States,2022.0,397,Industrials,Metal Fabrications
RBKB,Rhinebeck Bancorp Inc. Common Stock,78989617.0,United States,2019.0,25683,Finance,Major Banks
RBLX,Roblox Corporation Class A Common Stock,25526460491.0,United States,2021.0,15375246,Technology,EDP Services
RBOT,Vicarious Surgical Inc. Class A Common Stock,265211737.0,Hong Kong,2020.0,352750,Health Care,Medical Specialities
RBT,Rubicon Technologies Inc. Class A Common Stock,988209.0,None,2022.0,1019468,Technology,Semiconductors
RC,Ready Capital Corproation Common Stock,1233706630.0,United States,2013.0,4466941,Real Estate,Real Estate Investment Trusts
RC^C,Ready Capital Corporation 6.25% Series C Cumulative Convertible Preferred Stock,None,United States,None,246,None,None
RC^E,Ready Capital Corporation 6.50% Series E Cumulative Redeemable Preferred Stock,None,United States,None,20107,None,None
RCA,Ready Capital Corporation 7.00% Convertible Senior Notes due 2023,2776393646.0,United States,2017.0,9237,Real Estate,Real Estate Investment Trusts
RCAC,Revelstone Capital Acquisition Corp. Class A Common Stock,0.0,United States,2022.0,6403,Finance,Blank Checks
RCACU,Revelstone Capital Acquisition Corp. Unit,0.0,United States,2021.0,100,Finance,Blank Checks
RCACW,Revelstone Capital Acquisition Corp. Warrant,0.0,United States,2022.0,100,Finance,Blank Checks
RCAT,Red Cat Holdings Inc. Common Stock,52525747.0,United States,None,219527,Industrials,Wholesale Distributors
RCB,Ready Capital Corporation 6.20% Senior Notes due 2026,2584803658.0,United States,2019.0,1589,Real Estate,Real Estate Investment Trusts
RCC,Ready Capital Corporation 5.75% Senior Notes due 2026,2608060246.0,United States,2021.0,6063,Real Estate,Real Estate Investment Trusts
RCEL,Avita Medical Inc. Common Stock,436182600.0,United States,None,328108,Health Care,Medical/Dental Instruments
RCG,RENN Fund Inc Common Stock,0.0,United States,None,37330,Finance,Investment Managers
RCI,Rogers Communication Inc. Common Stock,23241080349.0,Canada,None,479517,Telecommunications,Cable & Other Pay Television Services
RCKT,Rocket Pharmaceuticals Inc. Common Stock,1737715944.0,United States,2015.0,2576518,Health Care,Biotechnology: Pharmaceutical Preparations
RCKTW,Rocket Pharmaceuticals Inc. Warrant,None,United States,None,100,Health Care,Biotechnology: Pharmaceutical Preparations
RCKY,Rocky Brands Inc. Common Stock,152670286.0,United States,1993.0,65092,Consumer Discretionary,Shoe Manufacturing
RCL,Royal Caribbean Cruises Ltd. Common Stock,24371704175.0,United States,1993.0,3913266,Consumer Discretionary,Marine Transportation
RCLF,Rosecliff Acquisition Corp I Class A Common Stock,0.0,United States,2021.0,5125,Health Care,Medical/Dental Instruments
RCLFU,Rosecliff Acquisition Corp I Unit,0.0,United States,2021.0,1103,Health Care,Medical/Dental Instruments
RCLFW,Rosecliff Acquisition Corp I Warrants,0.0,United States,2021.0,4604,Health Care,Medical/Dental Instruments
RCM,R1 RCM Inc. Common Stock,4833300309.0,United States,None,4499776,Consumer Discretionary,Other Consumer Services
RCMT,RCM Technologies Inc. Common Stock,147524883.0,United States,None,72783,Consumer Discretionary,Professional Services
RCON,Recon Technology Ltd. Class A Ordinary Shares,2948839.0,China,2009.0,76149,Energy,Oilfield Services/Equipment
RCRT,Recruiter.com Group Inc. Common Stock,4367920.0,United States,None,775843,Technology,EDP Services
RCRTW,Recruiter.com Group Inc. Warrant,478440.0,United States,None,100,Technology,EDP Services
RCS,PIMCO Strategic Income Fund Inc.,0.0,United States,1994.0,68481,Finance,Investment Managers
RCUS,Arcus Biosciences Inc. Common Stock,1428483033.0,None,2018.0,4395047,Health Care,Biotechnology: Pharmaceutical Preparations
RDCM,Radcom Ltd. Ordinary Shares,136858700.0,Israel,1997.0,19913,Technology,Computer peripheral equipment
RDFN,Redfin Corporation Common Stock,1202236225.0,United States,2017.0,2700034,Finance,Real Estate
RDHL,Redhill Biopharma Ltd. American Depositary Shares,7830688.0,Israel,None,42905,Health Care,Biotechnology: Pharmaceutical Preparations
RDI,Reading International Inc Class A Common Stock,62811056.0,United States,None,28668,Consumer Discretionary,Movies/Entertainment
RDIB,Reading International Inc Class B Common Stock,556390132.0,United States,None,36476,Consumer Discretionary,Movies/Entertainment
RDN,Radian Group Inc. Common Stock,3929156318.0,United States,None,3584866,Finance,Property-Casualty Insurers
RDNT,RadNet Inc. Common Stock,1830894060.0,United States,None,1303972,Health Care,Medical Specialities
RDVT,Red Violet Inc. Common Stock ,292818414.0,United States,None,47462,Technology,Computer Software: Prepackaged Software
RDW,Redwire Corporation Common Stock,181271379.0,United States,2021.0,347257,Industrials,Military/Government/Technical
RDWR,Radware Ltd. Ordinary Shares,905015100.0,Israel,1999.0,404605,Technology,EDP Services
RDY,Dr. Reddy's Laboratories Ltd Common Stock,10036635087.0,India,None,260855,Health Care,Biotechnology: Pharmaceutical Preparations
RE,Everest Re Group Ltd. Common Stock,13838625176.0,Bermuda,None,587665,Finance,Property-Casualty Insurers
REAL,The RealReal Inc. Common Stock,160278856.0,United States,2019.0,3793139,Consumer Discretionary,Other Specialty Stores
REAX,The Real Brokerage Inc. Common Shares,306505720.0,Canada,None,307293,None,None
REBN,Reborn Coffee Inc. Common Stock,11451920.0,United States,2022.0,12968,Consumer Discretionary,Restaurants
REE,REE Automotive Ltd. Class A Ordinary Shares,100113412.0,Israel,None,771684,Consumer Discretionary,Auto Manufacturing
REFI,Chicago Atlantic Real Estate Finance Inc. Common Stock,287610060.0,United States,2021.0,595853,Real Estate,Real Estate Investment Trusts
REFR,Research Frontiers Incorporated Common Stock,48588466.0,United States,None,180949,Technology,Industrial Machinery/Components
REG,Regency Centers Corporation Common Stock,10453654042.0,United States,1993.0,1102836,Real Estate,Real Estate Investment Trusts
REGN,Regeneron Pharmaceuticals Inc. Common Stock,85908614395.0,United States,1991.0,993659,Health Care,Biotechnology: Pharmaceutical Preparations
REI,Ring Energy Inc. Common Stock,353209154.0,United States,None,2646282,Energy,Oil & Gas Production
REKR,Rekor Systems Inc. Common Stock,106927295.0,United States,None,546604,Telecommunications,Telecommunications Equipment
RELI,Reliance Global Group Inc. Common Stock,7421268.0,United States,None,30224,Finance,Specialty Insurers
RELIW,Reliance Global Group Inc. Series A Warrants,215298.0,United States,None,262,Finance,Specialty Insurers
RELL,Richardson Electronics Ltd. Common Stock,255743070.0,United States,1983.0,144917,Technology,Electronic Components
RELX,RELX PLC PLC American Depositary Shares (Each representing One Ordinary Share),65000286145.0,United Kingdom,2015.0,2030410,Consumer Discretionary,Business Services
RELY,Remitly Global Inc. Common Stock,3338313691.0,United States,2021.0,1220371,Technology,Computer Software: Prepackaged Software
RENE,Cartesian Growth Corporation II Class A Ordinary Shares,0.0,United States,2022.0,1838,Finance,Blank Checks
RENEU,Cartesian Growth Corporation II Unit,0.0,United States,2022.0,1001,Finance,Blank Checks
RENEW,Cartesian Growth Corporation II Warrant,0.0,United States,2022.0,347,Finance,Blank Checks
RENN,Renren Inc. American Depositary Shares each representing fifteen Class A ordinary shares,28615220.0,China,2011.0,78014,Consumer Discretionary,Retail-Auto Dealers and Gas Stations
RENT,Rent the Runway Inc. Class A Common Stock,150127456.0,United States,2021.0,1334140,Consumer Discretionary,Other Specialty Stores
REPL,Replimune Group Inc. Common Stock,1377957433.0,United States,2018.0,2486566,Health Care,Biotechnology: Biological Products (No Diagnostic Substances)
REPX,Riley Exploration Permian Inc. Common Stock,756227221.0,United States,1999.0,85889,Energy,Oil & Gas Production
RERE,ATRenew Inc. American Depositary Shares (every three of which representing two Class A ordinary shares),655804871.0,None,2021.0,210200,Consumer Discretionary,Other Specialty Stores
RES,RPC Inc. Common Stock,1592481095.0,United States,None,6154963,Energy,Oilfield Services/Equipment
RETA,Reata Pharmaceuticals Inc. Class A Common Stock,3506553654.0,United States,2016.0,1454442,Health Care,Biotechnology: Pharmaceutical Preparations
RETO,ReTo Eco-Solutions Inc. Common Shares,6940200.0,China,2017.0,90687,Industrials,Industrial Machinery/Components
REUN,Reunion Neuroscience Inc. Common Shares,63428418.0,Canada,None,31661,None,None
REVB,Revelation Biosciences Inc. Common Stock,6230329.0,United States,2020.0,271681,Health Care,Biotechnology: Pharmaceutical Preparations
REVBW,Revelation Biosciences Inc. Warrant,128841.0,United States,2020.0,15005,Health Care,Biotechnology: Pharmaceutical Preparations
REVG,REV Group Inc. Common Stock,771140364.0,United States,2017.0,396222,Consumer Discretionary,Auto Manufacturing
REX,REX American Resources Corporation,588130443.0,United States,None,540380,Industrials,Major Chemicals
REXR,Rexford Industrial Realty Inc. Common Stock,10793240397.0,United States,2013.0,4017406,Real Estate,Real Estate Investment Trusts
REXR^B,Rexford Industrial Realty Inc. 5.875% Series B Cumulative Redeemable Preferred Stock,None,United States,None,2885,None,None
REXR^C,Rexford Industrial Realty Inc. 5.625% Series C Cumulative Redeemable Preferred Stock par value $0.01 per share,None,United States,None,3966,None,None
REYN,Reynolds Consumer Products Inc. Common Stock,5930653200.0,United States,2020.0,270293,Industrials,Office Equipment/Supplies/Services
REZI,Resideo Technologies Inc. Common Stock ,2592151323.0,None,2018.0,1686217,Industrials,Wholesale Distributors
RF,Regions Financial Corporation Common Stock,17002202459.0,United States,None,17528542,Finance,Major Banks
RF^B,Regions Financial Corporation Depositary Shares Representing 1/40th Perpetual Preferred Series B,None,United States,None,58255,None,None
RF^C,Regions Financial Corporation Depositary Shares each Representing a 1/40th Interest in a  Share of 5.700% Fixed-to-Floating Rate Non-Cumulative  Perpetual Preferred Stock Series C,None,United States,None,22844,None,None
RF^E,Regions Financial Corporation Depositary Shares Each Representing a 1/40th Interest in a Share of 4.45% Non-Cumulative Perpetual Preferred Stock Series E,None,United States,None,16074,None,None
RFAC,RF Acquisition Corp. Class A Common Stock,0.0,Singapore,2022.0,23,Finance,Blank Checks
RFACR,RF Acquisition Corp. Rights,0.0,Singapore,2022.0,2,Finance,Blank Checks
RFI,Cohen & Steers Total Return Realty Fund Inc. Common Stock,561268310.0,United States,1993.0,38910,Finance,Investment Managers
RFIL,RF Industries Ltd. Common Stock,45795248.0,United States,None,8025,Technology,Electrical Products
RFL,Rafael Holdings Inc. Class B Common Stock,53240247.0,United States,2018.0,48790,Finance,Real Estate
RFM,RiverNorth Flexible Municipal Income Fund Inc. Common Stock,91659338.0,None,2020.0,7033,Finance,Finance/Investors Services
RFMZ,RiverNorth Flexible Municipal Income Fund II Inc. Common Stock,334593127.0,None,2021.0,45473,Finance,Trusts Except Educational Religious and Charitable
RGA,Reinsurance Group of America Incorporated Common Stock,9517526432.0,United States,None,648249,Finance,Life Insurance
RGC,Regencell Bioscience Holdings Limited Ordinary Shares,311199200.0,Hong Kong,2021.0,114,Health Care, Medicinal Chemicals and Botanical Products
RGCO,RGC Resources Inc. Common Stock,211693214.0,United States,None,28172,Utilities,Oil & Gas Production
RGEN,Repligen Corporation Common Stock,8767367131.0,United States,1986.0,882291,Health Care,Biotechnology: Biological Products (No Diagnostic Substances)
RGF,The Real Good Food Company Inc. Class A Common Stock,84709492.0,United States,2021.0,20703,Consumer Staples,Packaged Foods
RGLD,Royal Gold Inc. Common Stock,7724430273.0,United States,None,1369214,Industrials,Precious Metals
RGLS,Regulus Therapeutics Inc. Common Stock,29212904.0,United States,2012.0,59914,Health Care,Biotechnology: Pharmaceutical Preparations
RGNX,REGENXBIO Inc. Common Stock,864107778.0,United States,2015.0,1391536,Health Care,Biotechnology: Biological Products (No Diagnostic Substances)
RGP,Resources Connection Inc. Common Stock,538396480.0,United States,None,1209059,Consumer Discretionary,Business Services
RGR,Sturm Ruger & Company Inc. Common Stock,914976545.0,United States,None,538642,Industrials,Ordnance And Accessories
RGS,Regis Corporation Common Stock,51033080.0,United States,1991.0,268190,Consumer Discretionary,Other Consumer Services
RGT,Royce Global Value Trust Inc. Common Stock,58219900.0,None,2013.0,3999,Finance,Trusts Except Educational Religious and Charitable
RGTI,Rigetti Computing Inc. Common Stock,0.0,United States,None,2809682,Technology,Retail: Computer Software & Peripheral Equipment
RGTIW,Rigetti Computing Inc. Warrants,0.0,United States,None,9657,Technology,Retail: Computer Software & Peripheral Equipment
RH,RH Common Stock,6231954829.0,United States,2012.0,947230,Consumer Discretionary,Other Specialty Stores
RHE,Regional Health Properties Inc. Common Stock,6421125.0,None,2017.0,4943,Real Estate,Real Estate
RHE^A,Regional Health Properties Inc. 10.875% Series A Cumulative Redeemable Preferred Stock,None,None,None,10,None,None
RHI,Robert Half International Inc. Common Stock,7911946979.0,United States,None,1385884,Consumer Discretionary,Professional Services
RHP,Ryman Hospitality Properties Inc. (REIT),5165136535.0,United States,None,776158,Real Estate,Real Estate Investment Trusts
RIBT,RiceBran Technologies Common Stock,6775980.0,United States,None,48148,Consumer Staples,Packaged Foods
RICK,RCI Hospitality Holdings Inc. Common Stock,721883724.0,United States,1995.0,63237,Consumer Discretionary,Restaurants
RIDE,Lordstown Motors Corp. Class A Common Stock,1001517226.0,United States,2019.0,50935791,Consumer Discretionary,Auto Manufacturing
RIG,Transocean Ltd (Switzerland) Common Stock,4774971327.0,Switzerland,None,13954853,Energy,Oil & Gas Production
RIGL,Rigel Pharmaceuticals Inc. Common Stock,277866888.0,United States,2000.0,1870067,Health Care,Biotechnology: Pharmaceutical Preparations
RILY,B. Riley Financial Inc. Common Stock,1163971261.0,United States,None,609121,Finance,Investment Managers
RILYG,B. Riley Financial Inc. 5.00% Senior Notes due 2026,10698631592.0,United States,None,4958,Finance,Investment Managers
RILYK,B. Riley Financial Inc. 5.50% Senior Notes Due 2026,0.0,United States,None,5088,Finance,Investment Managers
RILYL,B. Riley Financial Inc. Depositary Shares each representing 1/1000th in a share of 7.375% Series B Cumulative Perpetual Preferred Stock par value $0.0001,13347367550.0,United States,None,9099,Finance,Investment Managers
