Symbol,Name,Market Cap,Country,IPO Year,Volume,Sector,Industry
A,Agilent Technologies Inc. Common Stock,35778872834.0,United States,1999.0,3941294,Industrials,Electrical Products
AA,Alcoa Corporation Common Stock ,6354660967.0,None,2016.0,5811889,Industrials,Aluminum
AAC,Ares Acquisition Corporation Class A Ordinary Shares,755969351.0,None,2021.0,32767,Industrials,Metal Fabrications
AACG,ATA Creativity Global American Depositary Shares,44587260.0,China,2008.0,7494,Consumer Discretionary,Educational Services
AACI,Armada Acquisition Corp. I Common Stock,0.0,United States,2021.0,10,Finance,Blank Checks
AACIU,Armada Acquisition Corp. I Unit,0.0,United States,2021.0,5,Finance,Blank Checks
AACIW,Armada Acquisition Corp. I Warrant,0.0,United States,2021.0,40,Finance,Blank Checks
AACT,Ares Acquisition Corporation II Class A Ordinary Shares,0.0,None,2023.0,250958,None,None
AADI,Aadi Bioscience Inc. Common Stock,198672729.0,United States,None,257653,Health Care,Biotechnology: Pharmaceutical Preparations
AAIC,Arlington Asset Investment Corp Class A (new),119397482.0,United States,None,1462764,Real Estate,Real Estate Investment Trusts
AAIC^B,Arlington Asset Investment Corp 7.00% ,None,United States,None,133,None,None
AAIC^C,Arlington Asset Investment Corp 8.250% Seies C Fixed-to-Floating Rate Cumulative Redeemable Preferred Stock   ,None,United States,None,269,None,None
AAIN,Arlington Asset Investment Corp 6.000% Senior Notes Due 2026,669309385.0,United States,None,1175,Real Estate,Real Estate Investment Trusts
AAL,American Airlines Group Inc. Common Stock,10759174132.0,United States,None,22636024,Consumer Discretionary,Air Freight/Delivery Services
AAM^A,Apollo Asset Management Inc. 6.375% Series A Preferred Stock,None,United States,None,154429,None,None
AAM^B,Apollo Asset Management Inc. 6.375% Series B Preferred Stock,None,United States,None,140721,None,None
AAMC,Altisource Asset Management Corp Com,107457107.0,United States,None,19903,Finance,Real Estate
AAME,Atlantic American Corporation Common Stock,45622593.0,United States,None,572,Finance,Life Insurance
AAN,Aarons Holdings Company Inc. Common Stock ,411704031.0,None,2020.0,2026082,Consumer Discretionary,Diversified Commercial Services
AAOI,Applied Optoelectronics Inc. Common Stock,141599058.0,United States,2013.0,3897535,Technology,Semiconductors
AAON,AAON Inc. Common Stock,5197409905.0,United States,None,568502,Industrials,Industrial Machinery/Components
AAP,Advance Auto Parts Inc.,4114703435.0,United States,None,4971232,Consumer Discretionary,Auto & Home Supply Stores
AAPL,Apple Inc. Common Stock,2908551573840.0,United States,1980.0,101236522,Technology,Computer Manufacturing
AAT,American Assets Trust Inc. Common Stock,1196121354.0,United States,2011.0,763606,Real Estate,Real Estate Investment Trusts
AAU,Almaden Minerals Ltd. Common Shares,17646673.0,Canada,2015.0,166522,None,None
AB,AllianceBernstein Holding L.P.  Units,3796914288.0,United States,None,309237,Finance,Investment Managers
ABBV,AbbVie Inc. Common Stock,244601121235.0,United States,2012.0,14614985,Health Care,Biotechnology: Pharmaceutical Preparations
ABC,AmerisourceBergen Corporation Common Stock,37053303392.0,United States,None,2001124,Health Care,Other Pharmaceuticals
ABCB,Ameris Bancorp Common Stock,2450284841.0,United States,1994.0,1023159,Finance,Major Banks
ABCL,AbCellera Biologics Inc. Common Shares,2147088848.0,Canada,2020.0,3995489,Health Care,Pharmaceuticals and Biotechnology
ABCM,Abcam plc American Depositary Shares,5115056245.0,United Kingdom,2020.0,4761888,Health Care,Biotechnology: Biological Products (No Diagnostic Substances)
ABEO,Abeona Therapeutics Inc. Common Stock,84501819.0,United States,None,215225,Health Care,Biotechnology: Pharmaceutical Preparations
ABEV,Ambev S.A. American Depositary Shares (Each representing 1 Common Share),48668170070.0,None,2013.0,20356905,Consumer Staples,Beverages (Production/Distribution)
ABG,Asbury Automotive Group Inc Common Stock,4776044712.0,United States,2002.0,791613,Consumer Discretionary,Retail-Auto Dealers and Gas Stations
ABIO,ARCA biopharma Inc. Common Stock,30261300.0,United States,None,113843,Health Care,Biotechnology: In Vitro & In Vivo Diagnostic Substances
ABM,ABM Industries Incorporated Common Stock,2801284582.0,United States,None,1041569,Finance,Diversified Commercial Services
ABNB,Airbnb Inc. Class A Common Stock,76744624221.0,United States,2020.0,6892554,Consumer Discretionary,Hotels/Resorts
ABOS,Acumen Pharmaceuticals Inc. Common Stock,239586362.0,United States,2021.0,129792,Health Care,Biotechnology: Pharmaceutical Preparations
ABR,Arbor Realty Trust Common Stock,2512704929.0,United States,2004.0,3951285,Real Estate,Real Estate Investment Trusts
ABR^D,Arbor Realty Trust 6.375% Series D Cumulative Redeemable Preferred Stock Liquidation Preference $25.00 per Share,None,United States,None,9966,None,None
ABR^E,Arbor Realty Trust 6.25% Series E Cumulative Redeemable Preferred Stock,None,United States,None,2152,None,None
ABR^F,Arbor Realty Trust 6.25% Series F Fixed-to-Floating Rate Cumulative Redeemable Preferred Stock Liquidation Preference $25.00 per share,None,United States,None,4348,None,None
ABSI,Absci Corporation Common Stock,161880838.0,United States,2021.0,766292,Health Care,Biotechnology: Pharmaceutical Preparations
ABST,Absolute Software Corporation Common Stock,603445086.0,Canada,2020.0,1346532,Technology,Computer Software: Prepackaged Software
ABT,Abbott Laboratories Common Stock,184676150054.0,United States,None,10020548,Health Care,Medical/Dental Instruments
ABUS,Arbutus Biopharma Corporation Common Stock,413663700.0,Canada,None,2349561,Health Care,Biotechnology: Pharmaceutical Preparations
ABVC,ABVC BioPharma Inc. Common Stock,19262915.0,United States,None,28199,Health Care,Biotechnology: Pharmaceutical Preparations
AC,Associated Capital Group Inc. Common Stock,780916207.0,United States,2015.0,16516,Finance,Investment Bankers/Brokers/Service
ACA,Arcosa Inc. Common Stock ,3464210020.0,None,2018.0,987269,Industrials,Metal Fabrications
ACAB,Atlantic Coastal Acquisition Corp. II Class A Common Stock,0.0,United States,2022.0,28084,Finance,Blank Checks
ACAC,Acri Capital Acquisition Corporation Class A Common Stock,0.0,United States,2022.0,303,Finance,Blank Checks
ACACU,Acri Capital Acquisition Corporation Unit,0.0,United States,2022.0,91,Finance,Blank Checks
ACACW,Acri Capital Acquisition Corporation Warrant,0.0,United States,2022.0,85001,Finance,Blank Checks
ACAD,ACADIA Pharmaceuticals Inc. Common Stock,3914392873.0,United States,1985.0,1284683,Health Care,Biotechnology: Pharmaceutical Preparations
ACAH,Atlantic Coastal Acquisition Corp. Class A Common Stock,0.0,United States,2021.0,246,Finance,Blank Checks
ACAHW,Atlantic Coastal Acquisition Corp. Warrant,0.0,United States,2021.0,4350,Finance,Blank Checks
ACAQ,Athena Consumer Acquisition Corp. Class A Common Stock,0.0,None,2021.0,12,Finance,Blank Checks
ACAX,Alset Capital Acquisition Corp. Class A Common Stock,0.0,United States,2022.0,14,Health Care,Other Pharmaceuticals
ACAXR,Alset Capital Acquisition Corp. Right,0.0,United States,2022.0,354,Health Care,Other Pharmaceuticals
ACAXW,Alset Capital Acquisition Corp. Warrant,0.0,United States,2022.0,730,Health Care,Other Pharmaceuticals
ACB,Aurora Cannabis Inc. Common Shares,162236214.0,Canada,None,1329617,Health Care,Pharmaceuticals and Biotechnology
ACBA,Ace Global Business Acquisition Limited Ordinary Shares,42594508.0,Hong Kong,2021.0,27,Consumer Discretionary,Catalog/Specialty Distribution
ACBAU,Ace Global Business Acquisition Limited Unit,0.0,Hong Kong,2021.0,129,Consumer Discretionary,Business Services
ACBAW,Ace Global Business Acquisition Limited Warrant,0.0,Hong Kong,2021.0,11009,Consumer Discretionary,Business Services
ACCD,Accolade Inc. Common Stock,1002895666.0,United States,2020.0,646780,Consumer Discretionary,Business Services
ACCO,Acco Brands Corporation Common Stock,498316214.0,United States,None,1412513,Consumer Discretionary,Publishing
ACDC,ProFrac Holding Corp. Class A Common Stock,173425177.0,United States,2022.0,866126,Energy,Oilfield Services/Equipment
ACDCW,ProFrac Holding Corp. Warrant,118011.0,United States,None,31348,Energy,Oilfield Services/Equipment
ACEL,Accel Entertainment Inc. ,841130123.0,United States,2017.0,621509,Consumer Discretionary,Services-Misc. Amusement & Recreation
ACER,Acer Therapeutics Inc. Common Stock (DE),19921200.0,United States,None,281917,Health Care,Biotechnology: Biological Products (No Diagnostic Substances)
ACET,Adicet Bio Inc. Common Stock ,86195243.0,United States,2018.0,581990,Health Care,Biotechnology: Pharmaceutical Preparations
ACGL,Arch Capital Group Ltd. Common Stock,26414343509.0,Bermuda,None,3297818,Finance,Property-Casualty Insurers
ACGLN,Arch Capital Group Ltd. Depositary Shares each Representing a 1/1000th Interest in a 4.550% Non-Cumulative Preferred Share Series G,10796670977.0,Bermuda,None,28769,Finance,Property-Casualty Insurers
ACGLO,Arch Capital Group Ltd. Depositary Shares Each Representing 1/1000th Interest in a Share of 5.45% Non-Cumulative Preferred Shares Series F,12765702159.0,Bermuda,None,11455,Finance,Property-Casualty Insurers
ACGN,Aceragen Inc. Common Stock,14741132.0,United States,None,22838,Health Care,Biotechnology: Biological Products (No Diagnostic Substances)
ACHC,Acadia Healthcare Company Inc. Common Stock,6732336257.0,United States,None,1266318,Health Care,Medical Specialities
ACHL,Achilles Therapeutics plc American Depositary Shares,40118166.0,United Kingdom,2021.0,76917,Health Care,Biotechnology: Biological Products (No Diagnostic Substances)
ACHR,Archer Aviation Inc. Class A Common Stock,987315369.0,United States,2020.0,6878414,Industrials,Aerospace
ACHV,Achieve Life Sciences Inc. Common Shares,104816816.0,United States,None,230722,Health Care,Biotechnology: In Vitro & In Vivo Diagnostic Substances
ACI,Albertsons Companies Inc. Class A Common Stock,12265368921.0,United States,2020.0,13976420,Consumer Staples,Food Chains
ACIU,AC Immune SA Common Stock,167240000.0,Switzerland,2016.0,38177,Health Care,Biotechnology: Pharmaceutical Preparations
ACIW,ACI Worldwide Inc. Common Stock,2481664145.0,United States,None,2411970,Technology,EDP Services
ACLS,Axcelis Technologies Inc. Common Stock,5530797860.0,United States,2000.0,912155,Technology,Industrial Machinery/Components
ACLX,Arcellx Inc. Common Stock,1718168016.0,United States,2022.0,1016474,Health Care,Biotechnology: Pharmaceutical Preparations
ACM,AECOM Common Stock,12047024696.0,United States,2007.0,2080228,Consumer Discretionary,Military/Government/Technical
ACMR,ACM Research Inc. Class A Common Stock,696939087.0,United States,2017.0,1034369,Technology,Industrial Machinery/Components
ACN,Accenture plc Class A Ordinary Shares (Ireland),211834031015.0,Ireland,2001.0,5266262,Technology,EDP Services
ACNB,ACNB Corporation Common Stock,277517215.0,United States,None,22746,Finance,Major Banks
ACNT,Ascent Industries Co. Common Stock,95523954.0,United States,None,7356,Industrials,Steel/Iron Ore
ACON,Aclarion Inc. Common Stock,7940130.0,United States,2022.0,261423,Technology,Retail: Computer Software & Peripheral Equipment
ACONW,Aclarion Inc. Warrant,1339602.0,United States,2022.0,1779,Technology,Retail: Computer Software & Peripheral Equipment
ACOR,Acorda Therapeutics Inc. Common Stock,314199655.0,United States,2006.0,41769,Health Care,Biotechnology: Biological Products (No Diagnostic Substances)
ACP,abrdn Income Credit Strategies Fund Common Shares,0.0,United States,2011.0,226169,Finance,Investment Managers
ACP^A,abrdn Income Credit Strategies Fund 5.250% Series A Perpetual Preferred Stock,None,United States,None,3733,None,None
ACR,ACRES Commercial Realty Corp. Common Stock,71208024.0,United States,None,16875,Real Estate,Real Estate Investment Trusts
ACR^C,ACRES Commercial Realty Corp. 8.625% Fixed-to-Floating Series C Cumulative Redeemable Preferred Stock ,None,United States,None,14065,None,None
ACR^D,ACRES Commercial Realty Corp. 7.875% Series D Cumulative Redeemable Preferred Stock,None,United States,None,2606,None,None
ACRE,Ares Commercial Real Estate Corporation Common Stock,553283049.0,United States,2012.0,882570,Real Estate,Real Estate Investment Trusts
ACRO,Acropolis Infrastructure Acquisition Corp. Class A Common Stock,0.0,None,2021.0,24880,Finance,Blank Checks
ACRS,Aclaris Therapeutics Inc. Common Stock,722343417.0,United States,2015.0,1777150,Health Care,Biotechnology: Pharmaceutical Preparations
ACRV,Acrivon Therapeutics Inc. Common Stock,274074775.0,United States,2022.0,94962,Health Care, Medicinal Chemicals and Botanical Products
ACRX,AcelRx Pharmaceuticals Inc. Common Stock,12890667.0,United States,2011.0,101468,Health Care,Biotechnology: Pharmaceutical Preparations
ACST,Acasti Pharma Inc. Class A Common Stock,25652378.0,Canada,None,109662,Health Care,Pharmaceuticals and Biotechnology
ACT,Enact Holdings Inc. Common Stock,4029825825.0,United States,2021.0,282979,Finance,Specialty Insurers
ACTG,Acacia Research Corporation (Acacia Tech) Common Stock,265825163.0,United States,None,1144223,Miscellaneous,Multi-Sector Companies
ACU,Acme United Corporation. Common Stock,87579408.0,United States,1988.0,4356,Consumer Discretionary,Industrial Machinery/Components
ACV,Virtus Diversified Income & Convertible Fund Common Shares of Beneficial Interest,204461082.0,United States,2015.0,52478,Finance,Finance/Investors Services
ACVA,ACV Auctions Inc. Class A Common Stock,2830500762.0,United States,2021.0,1749427,Consumer Discretionary,Business Services
ACXP,Acurx Pharmaceuticals Inc. Common Stock,32447590.0,United States,2021.0,16802,Health Care,Biotechnology: Pharmaceutical Preparations
ADAG,Adagene Inc. American Depositary Shares,55363286.0,China,2021.0,15293,Health Care,Biotechnology: Pharmaceutical Preparations
ADAP,Adaptimmune Therapeutics plc American Depositary Shares,169016375.0,United Kingdom,2015.0,1327377,Health Care,Biotechnology: Biological Products (No Diagnostic Substances)
ADBE,Adobe Inc. Common Stock,227139066000.0,United States,1986.0,13336055,Technology,Computer Software: Prepackaged Software
ADC,Agree Realty Corporation Common Stock,6136185290.0,United States,None,1624488,Real Estate,Real Estate Investment Trusts
ADC^A,Agree Realty Corporation Depositary Shares each representing 1/1000th of a 4.250% Series A Cumulative Redeemable Preferred Stock,None,United States,None,3550,None,None
ADCT,ADC Therapeutics SA Common Shares,175895995.0,None,2020.0,404186,Health Care,Biotechnology: Pharmaceutical Preparations
ADD,Color Star Technology Co. Ltd. Class A Ordinary Shares,13972200.0,United States,None,85795,Consumer Discretionary,Engineering & Construction
ADEA,Adeia Inc. Common Stock,1132475610.0,United States,2003.0,1910600,Technology,Computer Software: Prepackaged Software
ADER,26 Capital Acquisition Corp. Class A Common Stock,0.0,United States,2021.0,200,Finance,Blank Checks
ADERW,26 Capital Acquisition Corp. Warrant,0.0,United States,2021.0,883,Finance,Blank Checks
ADES,Advanced Emissions Solutions Inc. Common Stock,36486839.0,United States,None,213706,Industrials,Major Chemicals
ADEX,Adit EdTech Acquisition Corp. Common Stock,99763044.0,None,2021.0,26506,Technology,EDP Services
ADI,Analog Devices Inc. Common Stock,94447151741.0,United States,None,6889165,Technology,Semiconductors
ADIL,Adial Pharmaceuticals Inc Common Stock,6906712.0,United States,2018.0,64858,Health Care,Biotechnology: Pharmaceutical Preparations
ADILW,Adial Pharmaceuticals Inc Warrant,162544.0,United States,2018.0,100,Health Care,Biotechnology: Pharmaceutical Preparations
ADM,Archer-Daniels-Midland Company Common Stock,41109035987.0,United States,None,5529637,Consumer Staples,Packaged Foods
ADMA,ADMA Biologics Inc Common Stock,873532741.0,United States,None,8224220,Health Care,Biotechnology: Biological Products (No Diagnostic Substances)
ADMP,Adamis Pharmaceuticals Corporation Common Stock,374064020.0,United States,None,35056,Health Care,Biotechnology: Pharmaceutical Preparations
ADN,Advent Technologies Holdings Inc. Class A Common Stock,13806010.0,United States,2018.0,1155880,Utilities,Power Generation
ADNT,Adient plc Ordinary Shares ,3709465315.0,None,2016.0,1558552,Consumer Discretionary,Auto Parts:O.E.M.
ADNWW,Advent Technologies Holdings Inc. Warrant,4231779.0,United States,2018.0,8373,Miscellaneous,Industrial Machinery/Components
ADOC,Edoc Acquisition Corp. Class A Ordinary Share,0.0,United States,2020.0,1,Health Care,Biotechnology: Biological Products (No Diagnostic Substances)
ADOCR,Edoc Acquisition Corp. Right,0.0,United States,2020.0,2,Health Care,Biotechnology: Biological Products (No Diagnostic Substances)
ADOCW,Edoc Acquisition Corp. Warrant,0.0,United States,2020.0,161,Health Care,Biotechnology: Biological Products (No Diagnostic Substances)
ADP,Automatic Data Processing Inc. Common Stock,91704283275.0,United States,None,3337351,Technology,EDP Services
ADPT,Adaptive Biotechnologies Corporation Common Stock,1210769290.0,United States,2019.0,1139233,Health Care,Biotechnology: Biological Products (No Diagnostic Substances)
ADRT,Ault Disruptive Technologies Corporation Common Stock,158412500.0,None,2022.0,1539798,Finance,Blank Checks
ADSE,ADS-TEC ENERGY PLC Ordinary Shares,296701600.0,Ireland,None,9073,Consumer Discretionary,Industrial Specialties
ADSEW,ADS-TEC ENERGY PLC Warrant,31789706.0,Ireland,None,2500,Consumer Discretionary,Industrial Specialties
ADSK,Autodesk Inc. Common Stock,45630590457.0,United States,None,3288990,Technology,Computer Software: Prepackaged Software
ADT,ADT Inc. Common Stock,5916567649.0,United States,2018.0,20547598,Consumer Discretionary,Diversified Commercial Services
ADTH,AdTheorent Holding Company Inc. Common Stock,129081175.0,United States,2021.0,370104,Consumer Discretionary,Advertising
ADTHW,AdTheorent Holding Company Inc. Warrants,8781032.0,United States,2021.0,600,Consumer Discretionary,Advertising
ADTN,ADTRAN Holdings Inc. Common Stock,844758276.0,United States,1994.0,2669384,Telecommunications,Telecommunications Equipment
ADTX,Aditxt Inc. Common Stock,3905289.0,United States,2020.0,100173,Health Care,Biotechnology: Pharmaceutical Preparations
ADUS,Addus HomeCare Corporation Common Stock,1487720547.0,United States,2009.0,348912,Health Care,Medical/Nursing Services
ADV,Advantage Solutions Inc. Class A Common Stock,696935391.0,United States,2019.0,589980,Consumer Discretionary,Advertising
ADVM,Adverum Biotechnologies Inc. Common Stock,152873922.0,United States,2014.0,503186,Health Care,Biotechnology: Pharmaceutical Preparations
ADVWW,Advantage Solutions Inc. Warrant,27553260.0,United States,2019.0,1880,Consumer Discretionary,Business Services
ADX,Adams Diversified Equity Fund Inc.,0.0,United States,None,72337,Finance,Investment Managers
ADXN,Addex Therapeutics Ltd American Depositary Shares,8613299.0,Switzerland,None,24350,Health Care,Biotechnology: Pharmaceutical Preparations
AE,Adams Resources & Energy Inc. Common Stock,87446633.0,United States,1980.0,8787,Energy,Oil Refining/Marketing
AEAE,AltEnergy Acquisition Corp. Class A Common Stock,0.0,United States,2021.0,123,Finance,Blank Checks
AEAEW,AltEnergy Acquisition Corp. Warrant,0.0,United States,2021.0,100,Finance,Blank Checks
AEE,Ameren Corporation Common Stock,22080204406.0,United States,None,2814158,Utilities,Power Generation
AEF,abrdn Emerging Markets Equity Income Fund Inc. Common Stock,254300721.0,United States,None,19666,Finance,Finance/Investors Services
AEFC,Aegon Funding Company LLC 5.10% Subordinated Notes due 2049,0.0,None,2019.0,25610,None,None
AEG,AEGON N.V. Common Stock,12720450020.0,Netherlands,None,1361677,Finance,Life Insurance
AEHL,Antelope Enterprise Holdings Limited Class A Ordinary Shares,15795220.0,China,None,111672,Industrials,Building Materials
AEHR,Aehr Test Systems Common Stock,1116525435.0,United States,1997.0,1095732,Industrials,Electrical Products
AEI,Alset Inc. Common Stock (TX),15145595.0,United States,2020.0,18031,Real Estate,Building operators
AEIS,Advanced Energy Industries Inc. Common Stock,4038255625.0,United States,1995.0,675479,Technology,Industrial Machinery/Components
AEL,American Equity Investment Life Holding Company Common Stock,3229885690.0,United States,2003.0,3278214,Finance,Life Insurance
AEL^A,American Equity Investment Life Holding Company Depositary Shares each representing a 1/1000th interest in a share of 5.95% Fixed-Rate Reset Non-Cumulative Preferred Stock Series A,None,United States,None,8494,None,None
AEL^B,American Equity Investment Life Holding Company Depositary Shares each representing a 1/1000th interest in a share of 6.625% Fixed-Rate Reset Non-Cumulative Preferred Stock Series B,None,United States,None,11644,None,None
AEM,Agnico Eagle Mines Limited Common Stock,25170918981.0,Canada,None,3136724,Basic Materials,Precious Metals
AEMD,Aethlon Medical Inc. Common Stock,8498659.0,United States,None,134818,Health Care,Medical/Dental Instruments
AENZ,Aenza S.A.A. American Depositary Shares,160395317.0,None,2018.0,1910,Industrials,Engineering & Construction
AEO,American Eagle Outfitters Inc. Common Stock,2318080211.0,United States,None,5553534,Consumer Discretionary,Clothing/Shoe/Accessory Stores
AEP,American Electric Power Company Inc. Common Stock,43721191986.0,United States,None,5317223,Utilities,Electric Utilities: Central
AEPPZ,American Electric Power Company Inc. Corporate Units,27941987983.0,United States,None,18603,Utilities,Electric Utilities: Central
AER,AerCap Holdings N.V. Ordinary Shares,15119460000.0,Netherlands,2006.0,1192510,Consumer Discretionary,Diversified Commercial Services
AES,The AES Corporation Common Stock,14283624179.0,United States,None,12279041,Utilities,Electric Utilities: Central
AESC,The AES Corporation Corporate Units,55578291178.0,United States,None,49825,Utilities,Electric Utilities: Central
AESI,Atlas Energy Solutions Inc. Class A Common Stock,1791000000.0,None,2023.0,1148955,Industrials,Metal Fabrications
AEVA,Aeva Technologies Inc. Common Stock,290876373.0,None,2020.0,1509604,Consumer Discretionary,Auto Parts:O.E.M.
AEY,ADDvantage Technologies Group Inc. Common Stock,9227106.0,United States,None,73834,Industrials,Office Equipment/Supplies/Services
AEYE,AudioEye Inc. Common Stock,65103130.0,United States,None,8792,Technology,Computer Software: Prepackaged Software
AEZS,Aeterna Zentaris Inc. Common Stock,13790688.0,Canada,None,2224,Health Care,Biotechnology: Pharmaceutical Preparations
AFAR,Aura FAT Projects Acquisition Corp Class A Ordinary Shares,0.0,Singapore,2022.0,1,Finance,Blank Checks
AFARW,Aura FAT Projects Acquisition Corp Warrant,0.0,Singapore,2022.0,100,Finance,Blank Checks
AFB,AllianceBernstein National Municipal Income Fund Inc,0.0,United States,2002.0,38481,Finance,Trusts Except Educational Religious and Charitable
AFBI,Affinity Bancshares Inc. Common Stock (MD),81688125.0,United States,2017.0,13850,Finance,Major Banks
AFCG,AFC Gamma Inc. Common Stock,267162386.0,United States,2021.0,395155,Real Estate,Real Estate Investment Trusts
AFG,American Financial Group Inc. Common Stock,9914061908.0,United States,None,805057,Finance,Property-Casualty Insurers
AFGB,American Financial Group Inc. 5.875% Subordinated Debentures due 2059,2015351016.0,United States,2019.0,5962,Finance,Property-Casualty Insurers
AFGC,American Financial Group Inc. 5.125% Subordinated Debentures due 2059,1807512619.0,United States,2019.0,5692,Finance,Property-Casualty Insurers
AFGD,American Financial Group Inc. 5.625% Subordinated Debentures due 2060,1992352505.0,United States,2020.0,3313,None,None
AFGE,American Financial Group Inc. 4.500% Subordinated Debentures due 2060,1540048452.0,United States,2020.0,26759,Finance,Property-Casualty Insurers
AFIB,Acutus Medical Inc. Common Stock,23473196.0,United States,2020.0,56520,Health Care,Biotechnology: Electromedical & Electrotherapeutic Apparatus
AFL,AFLAC Incorporated Common Stock,41951480263.0,United States,None,5587557,Finance,Accident &Health Insurance
AFMD,Affimed N.V.,107823480.0,Germany,2014.0,2008546,Health Care,Biotechnology: Pharmaceutical Preparations
AFRI,Forafric Global PLC Ordinary Shares,290035200.0,Gibraltar,None,31630,Consumer Staples,Packaged Foods
AFRIW,Forafric Global PLC Warrants,52328765.0,Gibraltar,None,7032,Consumer Staples,Packaged Foods
AFRM,Affirm Holdings Inc. Class A Common Stock,4929077735.0,United States,2021.0,12268777,Consumer Discretionary,Business Services
AFT,Apollo Senior Floating Rate Fund Inc. Common Stock,0.0,None,2011.0,41564,Finance,Investment Managers
AFTR,AfterNext HealthTech Acquisition Corp. Class A Ordinary Shares,0.0,None,2021.0,194735,Finance,Blank Checks
AFYA,Afya Limited Class A Common Shares,634940000.0,Brazil,2019.0,372107,Consumer Discretionary,Educational Services
AG,First Majestic Silver Corp. Ordinary Shares (Canada),1518259343.0,Canada,None,5004164,None,None
AGAC,African Gold Acquisition Corporation Class A Ordinary Shares,0.0,None,2021.0,5224,Finance,Blank Checks
AGAE,Allied Gaming & Entertainment Inc. Common Stock,39642007.0,United States,2017.0,31595,Telecommunications,Cable & Other Pay Television Services
AGBA,AGBA Group Holding Limited Ordinary Share,93019329.0,Hong Kong,2019.0,274277,Finance,Investment Managers
AGBAW,AGBA Group Holding Limited Warrant,3331098.0,Hong Kong,2019.0,11647,Finance,Investment Managers
AGCO,AGCO Corporation Common Stock,9872338098.0,United States,None,795237,Industrials,Industrial Machinery/Components
AGD,abrdn Global Dynamic Dividend Fund Common Shares of Beneficial Interest,0.0,United States,2006.0,34400,Finance,Trusts Except Educational Religious and Charitable
AGE,AgeX Therapeutics Inc. Common Stock,25958663.0,None,2018.0,12142,Health Care,Biotechnology: Pharmaceutical Preparations
AGEN,Agenus Inc. Common Stock,617510447.0,United States,2000.0,21499340,Health Care,Biotechnology: Biological Products (No Diagnostic Substances)
AGFY,Agrify Corporation Common Stock,1809890.0,United States,2021.0,566161,Consumer Discretionary,Military/Government/Technical
